datetime,title,content,url
2017-05-05 15:08,日照港：以“二四二”集疏运体系融入“一带一路”,中国证券网讯（记者 王宙洁 梁敏 赵静）“一带一路”国际合作高峰论坛召开在即，不少企业已经采取实际行动主动对接及融入“一带一路”倡议。其中，日照港形成了两条西进铁路、四条疏港高速和两条原油长输管线直通港区的集疏运体系。 日照港... ,"http://news.cnstock.com/news,bwkx-201705-4073130.htm"
2017-05-05 15:02,日照港高层：“一带一路”倡议带来三大机遇,中国证券网讯（记者 王宙洁 梁敏 赵静）距离“一带一路”倡议提出已有3年多的时间，日照港股份有限公司董事会秘书余慧芳本周对上证报记者表示，这一倡议为港口企业带来了三大机遇。 主要体现在：第一，港口作为陆地与海洋的边界、海运贸易活... ,"http://news.cnstock.com/news,bwkx-201705-4073129.htm"
2017-03-27 19:53,潞安环能：监事吕传田因严重违纪被立案调查,e公司讯，潞安环能（601699）3月27日晚间公告，日照港集团原财务预算部部长吕传田因严重违纪问题被立案审查，并被开除党籍，解除劳动合同，其涉嫌犯罪问题及线索被移送司法机关依法处理。吕传田系公司股东日照港派出监... ,http://finance.sina.com.cn/stock/s/2017-03-27/doc-ifycsukm3844678.shtml
2017-03-08 19:53,日照港：监事会主席孔宪雷涉嫌严重违纪 正接受审查,日照港3月8日晚间公告，日照港集团党委委员、副董事长、副总经理孔宪雷涉嫌严重违纪，目前正接受组织审查。孔宪雷现任公司监事会主席职务，鉴于此，公司已暂停孔宪雷行使监事会主席职权。公司目前生产经营一切正常。 ,http://stock.stockstar.com/JC2017030800003304.shtml
2017-03-08 19:43,日照港集团副总经理孔宪雷涉嫌严重违纪被查,日照港集团副董事长、副总经理孔宪雷涉嫌严重违纪被查 澎湃新闻 来源：澎湃新闻 3月8日，日照港股份有限公司（日照港，600017.SH）在上海证券交易所发布公告称，该公司于3月8日通过中共日照市纪律检查委员会、... ,http://finance.sina.com.cn/chanjing/gsnews/2017-03-08/doc-ifychavf2084338.shtml
2017-03-08 18:27,日照港：监事会主席孔宪雷涉嫌严重违纪 正接受组织审查,e公司讯，日照港（600017）3月8日晚间公告，日照港集团党委委员、副董事长、副总经理孔宪雷涉嫌严重违纪，目前正接受组织审查。孔宪雷现任公司监事会主席职务，鉴于此，公司已暂停孔宪雷行使监事会主席职权。公司目前生... ,http://finance.sina.com.cn/stock/s/2017-03-08/doc-ifycaafp2307000.shtml
2017-03-02 15:45,东明石化牵手日照港签署30万吨原油码头项目,2月27日，东明石化集团与日照港油品码头有限公司、日照华信石油储备基地有限公司签署30万吨原油码头及港内油库项目合资合作协议。该合资项目投资总额约为39亿元，包括一座30万吨级原油码头、2座15万吨级原油码头及内航道工程、港内156万... ,http://news.mysteel.com/17/0302/15/615973C54DBF0CF2.html
2017-02-03 09:20,日照港迎来瓦日线兴保铁路首列煤炭,2017年1月30日15时30分，日照港迎来瓦日线兴保铁路首列煤炭。该煤炭列车装载3932吨原煤，由山西冯家川站发车，经兴县、长治等站点到达日照港。 自2016年9月19日，瓦日铁路正式运营后，首列重载列车到港，日照港股份一公司围绕瓦日铁路沿... ,http://info.glinfo.com/17/0203/09/9ADACBA7FD1622BC.html
2016-12-28 18:25,日照港原董事长杜传志被带走：上月刚调任日照国资委,原日照港董事长杜传志被带走调查：上月刚调任日照市国资委 来源：澎湃新闻 澎湃新闻记者从多个独立信源渠道证实，山东省日照市国资委党委书记杜传志于上周被纪委相关人员带走接受调查。 “职务公布了，但是一直... ,http://finance.sina.com.cn/chanjing/gsnews/2016-12-28/doc-ifxzcvfp5003664.shtml
2016-12-27 03:13,日照港股份有限公司,原标题：日照港股份有限公司 证券代码：600017证券简称：日照港公告编号：2016-053 债券代码：122121债券简称：11日照港 债券代码：122289债券简称：13日照港 日照港股份有限公司 2016年第五次临时股东大会决议公告 本公司... ,http://finance.sina.com.cn/roll/2016-12-27/doc-ifxyxvcr7687143.shtml
2016-11-17 06:40,多因素致港口航运短期爆仓 业内称行业复苏为时尚早,港口航运“爆仓”行业复苏为时尚早 记者 王玉凤 陈姗姗 “欧线、美国线、南美线等主要航线几乎全部出现爆仓情况，海运费价格飞涨。”市场日前传出了深圳港、天津港等主要口岸航运仓位极度紧张的消息。 A股的港口... ,http://finance.sina.com.cn/chanjing/cyxw/2016-11-17/doc-ifxxwrwk1280782.shtml
2016-10-17 21:14,驶向深蓝——写在日照港上市十周年之际,10月17日，日照港（600017）股份有限公司(以下简称：日照港股份)办公楼里，工作人员照常上班，忙碌而有序，平静地迎来上市十周年的日子。 十年之间，日照港股份的资产总额翻了三倍，股本总额翻了六倍；十年之间，日照港集团有限公司(以下简... ,http://stock.10jqka.com.cn/20161017/c594010080.shtml
2016-10-17 10:25,日照港：多条交通干线开通 面临新机遇,证券时报记者 崔晓丽 种种迹象表明，日照港（600017）正迎来新的发展机遇。近日，日照-澳大利亚航线、瓦日铁路、日照至韩国釜山的集装箱外贸航线等交通干线相继开通，给日照港打开新的发展空间。同时，公司大股东日照港集团第三个30万吨级原油码... ,http://company.stcn.com/2016/1017/12909245.shtml
2016-09-22 09:58,瓦日铁路助力山西煤炭经济发展,9月19日0时30分，日照港迎来瓦日铁路全线运营首列重载列车。列车由山西兴县北站发车，经临汾、长治等站点直达日照港，在瓦日线运行全长1177公里，共运行约24个小时，运载3668吨原煤。日照港股份一公司经过1小时15分钟完成了卸车作业。... ,http://finance.glinfo.com/16/0922/09/E8A1B83B354C1D47.html
2016-09-21 19:01,京博物流1.8亿元参股新公司,公司拟与日照港集团有限公司、齐鲁交通发展集团有限公司、山东汇丰石化集团有限公司、山东金诚石化集团有限公司共同出资设立参股公司日照港港达管道输油有限公司，注册资本12亿元，其中公司出资1.8亿元。标的公司主营原油、燃料油、成品油及其他液体... ,http://jrz.cnstock.com/kx/201609/3905355.htm
2016-09-20 18:33,京博物流拟出资1.8亿 与4家企业设立合资公司,读懂新三板报道 9月20日，京博物流（834616.OC）宣布拟出资1.8亿元，与4家企业设立日照港港达管道输油有限公司。据悉，此次公司出资1.8亿元，占注册资本的15.00%。其余4家企业为4家企业分别为日照港集团有限公司、齐鲁交通发展集团有限公司、山东汇丰石化集团... ,http://www.ddxsb.com/post/13672.html
2016-09-16 11:04,失落的铁矿石第一大港日照港：纳税额不及下属房地产公司,山东省日照港第一生活区内部团购房的几张选房名单，张贴在日照港国贸中心一侧的玻璃门上，几张A4纸隐约覆盖着一层褐红色的浮尘，这是毗邻日照港周边事物的特有印记。湿热的海风扬起这些来自巴西、澳大利亚等地的... ,http://finance.sina.com.cn/chanjing/gsnews/2016-09-16/doc-ifxvyqvy6507230.shtml
2016-08-05 00:33,5日机构强推买入 6股极度低估,"积极向现代化服务商转变。上半年,日照港（600017）开通了国内首条中美大豆散货班轮航线,搭建起从全球最大粮食生产地到全球最大粮食进口口岸的高速通道。公司将推动港口由装卸运输中心向国际物流中心升级,由传统装卸生产者向现代化服务商转变... ",http://stock.10jqka.com.cn/20160805/c592183552.shtml
2016-07-13 02:06,日照港吞吐原油“肚量不小”,受低油价和国家政策红利的影响，我国原油进口量逐年攀升，对外依存度已超60%，同时港口的关注度也随之升温。海关总署表示，5月原油进口量下降是因为今年以来山东青岛港一直“船”满为患，从而抑制了独立炼油商的购买。确实，山东作为东部沿海... ,http://stock.10jqka.com.cn/20160713/c591673621.shtml
2016-06-29 01:42,日照港口医院牵手北京同仁医院开展眼科合作,日前，日照港（600017）口医院与北京同仁医院签署合作协议，成为北京同仁医院眼科研究所“远程眼科会诊基地”。北京同仁医院是一所以眼科、耳鼻咽喉科和心血管疾病诊疗为重点的大型综合性医院，其眼科的眼底病、眼外伤、青光眼、角膜移植、眼... ,http://stock.10jqka.com.cn/20160629/c591307582.shtml
2016-04-27 18:54,日照港集团45万吨原油码头开工,本报记者 董文杰 随着日照港控股股东日照港集团的整体上市承诺渐近，日照港集团加快培育其原油码头和集装箱码头资产。4月27日，记者在日照港2015年年度股东大会上获悉，日照港集团第三个30万吨原油码头（按45万吨级水工... ,http://finance.sina.com.cn/stock/t/2016-04-27/doc-ifxrpvqz7119138.shtml
2016-04-05 21:02,[年报]日照港去年净利3.08亿 同比下降46%,全景网4月5日讯 日照港（600017）周二晚间发布年度报告，公司2015年实现净利润3.08亿元，同比下降46.17%，每股收益0.1元。报告期内，公司实现营业收入43.78亿元，同比下降13.88%。日照港表示，报告期内，公司主营业务收入同比减少6.96亿元，降低1... ,http://stock.sohu.com/20160405/n443391281.shtml
2016-03-24 15:20,日照大宗举行煤炭挂牌上市暨CPE调期交易说明会,3月24日上午，煤炭交易品种在日照大宗商品交易中心挂牌上市。晋煤集团党委副书记、工会主席张虎龙与日照港（600017）集团董事、副总经理庄光安为煤炭品种鸣锣开市。日照港“因煤而生”，是我国重要的煤炭输出港之一，拥有中国吃水最深、泊位... ,http://stock.10jqka.com.cn/20160324/c588741423.shtml
2016-03-14 10:39,日照港大宗商品交易中心或新增煤炭品种,日照港集团董事长杜传志11日在京表示，日照港今年内可望开通两条新的国际集装箱货运航线。同时，将考虑增加煤炭成为日照港大宗商品交易中心新的交易品种。借力于中韩、中澳自贸协定的签署，日照港今年拟新开通至澳大利亚和韩国仁川的新航... ,http://info.glinfo.com/16/0314/10/7A29764801D82F05.html
2016-03-11 17:28,日照港年内计划开通至澳洲和韩国仁川新航线,中国证券网讯(记者 赵静)日照港（600017）董事长杜传志11日在京表示，日照港年内可望开通至澳大利亚和韩国仁川的集装箱货运航线。据介绍，日照港与澳大利亚的航线谈判已基本结束，开通后这将成为日照港的第一条远洋集装箱航线。另外，因为现... ,http://stock.10jqka.com.cn/20160311/c588455982.shtml
2016-03-08 06:56,杜传志：建议推动港口资源整合，实现集约发展,全国人大代表、日照港集团董事长杜传志：建议推动港口资源整合，实现集约发展 业务雷同、腹地交叉等先天因素让港口站在了十字路口，业务整合似乎成了发展的趋势。3月5日下午，全国人大代表、日照港集团董事长、党委书记杜传志在... ,http://www.p5w.net/stock/news/gsxw/201603/t20160308_1376877.htm
2016-03-07 11:00,日照港董事长杜传志：建议提升港口集成和整合功能,中证网讯 3月5日下午，全国人大代表，日照港（600017）集团董事长、党委书记杜传志在十二届全国人大四次会议山东代表团全体会议上表示，李克强总理所作的政府工作报告，主题鲜明，内涵丰富，要求明确，措施有力，是一个符合国情、顺应民意、... ,http://stock.10jqka.com.cn/20160307/c588353010.shtml
2016-03-01 10:48,美国波特兰港至日照港大豆散货班轮成功首航,中国航贸网 近日，美国波特兰港至日照港（600017）大豆散货船“哈蒙德”轮成功首航，标志着日照港打造国际粮食物流中心迈出重要一步。该班轮航线，由日照港集团与美国哥伦比亚谷物贸易有限公司、山东晨曦集团共同合作开发。航线开通初期，每... ,http://stock.10jqka.com.cn/20160301/c588206703.shtml
2016-02-22 02:01,日照港待偿“债融”余额逾 130亿,摘要： 今日，日照港集团有限公司将发行 2016年度第一期超短期融资券，金额为10亿元。经济导报记者查阅其募集说明书发现，日照港集团负债规模增长较快，资产负债率持续上升，短期有息债务规模较大。公司对外担保金额较大，担保比率较高，存在... ,http://stock.10jqka.com.cn/20160222/c587970442.shtml
2016-01-25 12:59,日照港“十二五”期生产实现持续快速增长,山东省交通运输厅 “十二五”期间，日照港（600017）累计完成吞吐量15.2 亿吨，是“十一五”的1.9 倍，年均增长8.3%。其中，2015年达到3.37 亿吨，比2010年净增1.11亿吨。累计完成集装箱吞吐量1041万标箱，是“十一五”的3.2倍，年均增长21.5... ,http://stock.10jqka.com.cn/20160125/c587511015.shtml
2016-01-11 10:59,日照市委书记杨军就日照港建设和发展提出要求,山东省交通运输厅 近日，日照市委书记、市人大常委会主任杨军到日照港（600017）集团进行调研，并就港口改革发展提出四项要求。一是认真贯彻落实党的十八届五中全会精神，抢抓“蓝红金”和“一带一路”国家战略机遇，发挥港口核心竞争力优势... ,http://stock.10jqka.com.cn/20160111/c587116698.shtml
2015-12-22 05:56,日照钢铁精品基地配套矿石码头开工建设,12月18日上午，日照港岚山港区北作业区华海船厂南侧的空地上彩旗飘飘，随着一声“开工”的号令，日照钢铁精品基地项目配套矿石码头工程正式开工建设。日照钢铁精品基地配套矿石码头由山东钢铁集团、山东省国投与日照港集团三方合资成立的... ,http://info.glinfo.com/15/1222/05/56DC12152A10AB48.html
2015-12-21 08:54,山钢发力“内部市场化改革” 日照基地建设提速,山东钢铁（个股资料 操作策略 咨询高手 实盘买卖） 上周五(18日)，日照港岚山港区北作业区，日照钢铁精品基地配套矿石码头开工仪式在此举行。“日照钢铁精品基地配套矿石码头正式开工，是山钢集团、山东省国投、日照港集团合资项目正式在日照... ,http://stock.stockstar.com/SS2015122100000361.shtml
2015-12-14 19:12,日照港控股股东完成1.1亿元增持计划,中国证券网讯（记者 严政）日照港12月14日晚间公告称，公司控股股东日照港集团于8月3日至12月11日期间累计增持公司股份1646.72万股，增持市值1.1亿元，其关于增持公司股份计划已实施完毕。公告显示，日照港集团于2015年8月3... ,http://finance.sina.com.cn/roll/2015-12-14/doc-ifxmpnqf9751016.shtml
2015-11-26 10:41,【路演预告】日照港国改窗口临近，料后市可期？,"大智慧阿思达克通讯社11月26日讯,近期，日照港备受资本市场宠爱，港口整合、国企改革、一带一路 、中日韩自贸区、优质资产注入，五大概念集于一体；又有安信证券、长江证券、申万宏源证券等几大券商在研报中齐喊“增持”。日照港地处... ",http://www.gw.com.cn/news/news/2015/1126/200000453494.shtml
2015-11-18 10:46,日照港：“港口+”整合供应链 拓展“朋友圈”,日照新闻 以“金融”为抓手，以港口为核心节点，利用现代信息技术，整合供应链上下游，优化资源配置，日照港（600017）通过启动 “港口+”模式，成功破解货源市场下行压力，赢得了了越来越多企业和贸易商的青睐。一个月前，满载17.8万吨精粉... ,http://stock.10jqka.com.cn/20151118/c585926535.shtml
2015-11-12 13:10,日照港开启“贸易+物流+金融+监管”新型战略合作模式,山东省交通运输厅 近日，随着乌克兰籍“土库曼斯坦”轮满载17.8万吨乌克兰精矿粉，顺利靠泊日照港（600017）矿石码头10泊位并完成接卸，日照港开启的“贸易+物流+金融+监管”新型战略合作模式成功付诸实施。此次新型战略合作模式由日照银行、... ,http://stock.10jqka.com.cn/20151112/c585824033.shtml
2015-11-10 13:50,日照港集团有限公司17日将发行12亿元366天期短融,中证网讯公告显示，日照港（600017）集团有限公司将于11月17日发行12亿元366天期的2015年度第二期短期融资券。浙商银行股份有限公司为主承销商兼簿记管理人。本期短融券将由主承销商组织承销团，通过簿记建档、集中配售的方式在银行间市场公... ,http://stock.10jqka.com.cn/20151110/c585768235.shtml
2015-11-04 08:53,湖南装备制造巨头泰富重装联手日照港进军国际港口市场,随着‘一带一路’战略的兴起，国内外海工装备制造及港口水运市场潜能巨大。湖南装备制造业巨头泰富重装集团近日与山东日照港集团、上海华信国际集团在日照碧波大酒店签署三方合作协议，共同出资成立合资公司日照港富华（国际）码头管理... ,http://finance.glinfo.com/15/1104/08/C87B5151EB21F16B.html
2015-10-21 12:58,日照港四方合作首船靠泊,10月17日21时，在日照港（600017）股份二公司东10泊位，满载17.8万吨乌克兰精粉的“土库曼斯坦”轮顺利靠泊。该轮是日照银行、日照港股份二公司、日照港物流保税中心和河北敬业集团采用“贸易+物流+金融+监管”的四方合作模式后的第一艘船，... ,http://stock.10jqka.com.cn/20151021/c585162271.shtml
2015-09-30 05:26,环渤海港口业务结构雷同 日照港布局原油接卸求生,环渤海港口业务结构雷同 日照港布局原油接卸求生 每经记者 彭斐 对以大宗干散货装卸起家的日照港(600017，SH)来说，铁矿石、煤炭是立命之本，上半年这两项业务的下滑，令其业绩几近腰斩。对于原因，日照港的解释是：受国内经济... ,http://finance.sina.com.cn/china/dfjj/20150930/051923384202.shtml
2015-09-06 09:22,Mysteel:天津港、日照港、董家口港焦炭情况调研,调研对象：天津港、日照港、董家口港 调研目的：了解港口焦炭库存情况、焦炭1509合约交割情况 调研方式：实地走访 调研人员：赵越 调研时间：2015年8月26日-29日 一、港口焦炭基本情况 a)港口焦炭库存情况 2015-8-28 天津港 190 2015-8-2... ,http://info.glinfo.com/15/0906/09/58CB82F289F5BB40.html
2015-08-31 15:06,日照港集团有限公司9月7日发行15亿元270天期超短融,公告显示，日照港（600017）集团有限公司将于9月7日发行2015年度第四期超短期融资券。中国农业银行（601288）股份有限公司为此次发行的主承销商兼簿记管理人。本期超短融规模15亿元，期限270天，将由主承销商组织承销团，通过簿记建档集中配... ,http://bond.10jqka.com.cn/20150831/c581430699.shtml
2015-08-28 06:41,日照铁矿石期货保税交割业务获批,8月18日，经海关总署同意，青岛海关正式批准大连商品交易所在日照港股份有限公司所属的日照物流公用型保税仓库开展铁矿石期货保税交割业务，该项业务的成功获批，标志着复制推广上海自贸区14项海关监管创新制度在日照市的成功落地。期货... ,http://info.glinfo.com/15/0828/06/91D22C5B0BD7BC0E.html
2015-08-19 15:50,港口业上市公司中报陆续发布 半年报显示业绩欠佳,日照港、厦门港务、锦州港等港口行业上市公司近日发布半年报，港口行业上半年表现欠佳。据公告，日照港上半年营业收入同比下降15.74%，利润总额、净利润同比下降均在四成左右。厦门港务上半年营业收入比去年同期下降了0.41%，归属于上市公司... ,http://stock.stockstar.com/SS2015081900001846.shtml
2015-08-19 00:53,受益债市回暖 企业发债紧锣密鼓,经济导报记者 时超 受债券市场回暖影响，债市发行工作迎来一波小高潮。17日，包括日照港、烟台港在内的多家公司发布了债券品种发行计划。其中，日照港拟发行10亿元230天的超短期融资券，资金将用于补充本部的营运资金需求及偿还部... ,http://finance.sina.com.cn/stock/t/20150819/004722999358.shtml
2015-08-17 20:31,日照港上半年净利润2.26亿元 下降43.69%,"日照港(600017,咨询) 8月17日晚间发布2015年半年度报告，2015年上半年，受业务吞吐量下降的影响，公司共实现营业收入22.03亿元，同比下降15.74%；发生营业成本16.68亿元，同比下降8.82%；实现利润总额3.28亿元，同比下降43.00%；实现净利润2.... ",http://stock.stockstar.com/JC2015081700002264.shtml
2015-08-17 17:27,日照港上半年营收净利双降 称港口吞吐量下滑所致,中国网财经8月17日讯日照港（600017）今日晚间发布了2015年半年报，报告期内，公司实现营业收入22.03亿元，同比减少15.74%；实现归属于上市公司股东的净利润为2.26亿元，同比下降43.69%。公司表示，营业收入下降是因为受国家经济形势下行影响... ,http://stock.10jqka.com.cn/20150817/c580750648.shtml
2015-07-04 07:23,交通部正式放行40万吨大船入华,交通部正式放行40万吨大船入华 核心摘要 和青岛港的40万吨矿石码头一道获批的，还有大连港、宁波舟山港、唐山港的另外6个泊位，而曾经传出在争取大船靠泊的天津港、连云港、日照港、湛江港等则未能出现在前述方案中。本报记者 肖夏 ... ,http://finance.sina.com.cn/china/20150704/071822590143.shtml
2015-06-17 15:06,中亚五国会议日照启幕，中亚（日照）港口物流园揭牌,大智慧阿思达克通讯社6月17日讯，第三届中国-中亚合作论坛16日（周二）在日照启幕，大智慧通讯社获悉，在论坛首日，中亚（日照）港口物流园揭牌。中亚（日照）港口物流园地处日照国家级经济技术开发区，由日照港集团与哈萨克斯坦、吉... ,http://www.gw.com.cn/news/news/2015/0617/200000441265.shtml
2015-06-16 14:17,山东日照建中亚(日照)港口物流园 服务一带一路,中新社日照6月16日电 (李欣)由中国和中亚五国六家企业共同投资的中亚(日照)港口物流园区6月16日在山东省日照市正式揭牌，园区将成为中亚国家和内陆地区向东出海的现代商贸物流基地，服务“一带一路”经济发展。记者采访了解... ,http://finance.sina.com.cn/chanjing/cyxw/20150616/133222445203.shtml
2015-06-15 17:09,山东副省长：日照要抢占自贸区建设先机 日照港为属地公司,鸡毛信jmxer6月15日上午盘中封闭期解封后消息：6月14日，山东副省长夏耕带领青岛海关和省检验检疫部门负责同志到日照市岚山区调研。夏耕强调，要把争取设立综合保税区作为当前对外开放工作的头等大事来抓，努力在自贸区建设等方面抢占先机、争... ,http://stock.caijing.com.cn/20150615/3905484.shtml
2015-06-08 13:46,(独家)中国-中亚合作论坛即将在日照启幕，合作物流园区成重头戏,大智慧阿思达克通讯社6月8日讯，接近日照港（600017.SH）的人士向大智慧通讯社表示，第三届中国-中亚合作论坛将于6月14号左右在日照开幕，论坛为期三天，在此次论坛上，日照港有望同与会中亚国家签署相关协议，其中中亚（日照）港口... ,http://www.gw.com.cn/news/news/2015/0608/200000439375.shtml
2015-06-07 21:00,日照港董秘余慧芳荣获2014年新浪财经最佳董秘,新浪财经讯 6月7日晚新浪财经举行“2014年最佳上市公司董秘”盛大颁奖活动--金牌董秘之夜。50名2014年“最佳上市公司董秘”获邀出席颁奖现场。其中日照港董秘余慧芳获2014年“最佳上市公司董秘”，华婷奖获奖理由如下： 日照港在处... ,http://finance.sina.com.cn/stock/s/20150607/205922369074.shtml
2015-05-20 13:54,日照港与山东省经投签战略合作协议 日照市长出席,鸡毛信5月20日上午盘中封闭期解封后消息：昨日上午，日照市政府与山东省经济开发投资公司签署战略合作协议。日照市委副书记、市长刘星泰，省经济开发投资公司总经理李国健分别致辞。鸡毛信jmxer根据协议，山东省经济开发投资公司将与日照港集团... ,http://stock.caijing.com.cn/20150520/3887072.shtml
2015-05-15 20:00,日照港加速掘金“一路一带” 山东高层力挺其作蒙古出海口,《每日经济新闻》记者从山东省发改委获悉，针对该委报送的《关于日照港（600017）争取蒙古国出海口有关情况》，山东省委书记姜异康作出重要批示。作为国内铁矿石现货吞吐量第一大港，日照港(600017，SH)正在积极争取成为蒙古国出海口。日前，... ,http://stock.10jqka.com.cn/20150515/c572776325.shtml
