datetime,title,content,url
2014-04-15 11:22,自贸区内首家合资旅行社，花落地中海邮轮旅行社,大智慧阿思达克通讯社4月15日讯，据大智慧通讯社（微信:dzh_news)了解到，近日，由地中海邮轮公司与上港集团(600018.SH)下属的国际客运中心有限公司合资成立的地中海邮轮旅行社，成为首家入驻上海自贸区的合资旅行社。***上海自贸区... ,http://www.gw.com.cn/news/news/2014/0415/200000334342.shtml
2014-04-08 08:18,节后首周限售股解禁约167亿元,上港集团定增股票三年盈利10% 本报讯 (文/表 记者张忠安)A股本周限售股解禁规模167亿元左右，涉及的上市公司有13家。其中，上港集团以83.28亿元的市值成为本周解禁规模最大的个股，其次，日发精机和高盟新材本周的解禁市值均在... ,http://finance.sina.com.cn/stock/data/20140408/081418731114.shtml
2014-04-05 09:46,上港集团(600018)逾17亿定增股下周解禁,本报讯 (记者 陈慧)清明节过后，虽然沪深两市交易日减少一天，但由于上港集团（600018）巨量定增股解禁，两市解禁规模较本周反而有所增加。据数据统计，下周限售股解禁数量约为30.5亿股，以周五收盘价计算，市值达272.7亿元，分别较本周增加5... ,http://stock.10jqka.com.cn/20140405/c564780828.shtml
2014-04-04 08:50,东旭光电八连阴居连阴榜首位，七连阴个股数量减少,大智慧阿思达克通讯社4月4日讯，截止周四（4月3日），两市八连阴的个股有1只，七连阴的个股有1只，六连阴的个股有2只，五连阴的个股有1只，四连阴的个股有7只。较上一交易日，周四两市七连阴的个股数量减少3只，六连阴的个股数量减少... ,http://www.gw.com.cn/news/news/2014/0404/200000331150.shtml
2014-04-02 09:36,李晨曦：宁波港和上海港之间的竞争有限,大智慧阿思达克通讯社4月2日讯，上海航运中心建设推进领导小组副主任李晨曦昨日表示，上海港[上港集团（600018.SH）]和宁波港（601018.SH）的竞争有限。李晨曦是在2014年集装箱多式联运亚洲展创新性论坛上作出如上表述的，他表示，竞... ,http://www.gw.com.cn/news/news/2014/0401/200000330116.shtml
2014-04-01 11:35,上港集团(600018)：港口主业符合预期 改革预期与自贸...,"主营业务稳定增长,商业地产锦上添花。公司营业收入同比下降0.77%,主要原因是上海港务工程公司改制,不纳入合并报表范围,按同口径计算营收同比增长2.9%,略低于3.8%的集装箱吞吐量增速。营业成本同比下降3.09%,毛利率上涨1.59个百分点到33.66%。... ",http://news.10jqka.com.cn/20140401/c564705912.shtml
2014-03-31 11:32,上港集团(600018)：业绩基本符合预期,"公司公告/新闻:上港集团（600018）公告2013年年报,报告期公司实现营业总收入281.6亿元、营业利润71.5亿元、利润总额78.2亿元、归属于上市公司股东的净利润52.6亿元,分别同比增长-0.8%、9.0%、8.8%和5.8%。对应基本每股收益为0.23元,同比增长4... ",http://stock.10jqka.com.cn/20140331/c564684794.shtml
2014-03-31 09:18,上港集团(600018)改革先行 养猪业遭遇“寒流”,备受关注的合肥综合保税区终于尘埃落定。上周，合肥海关对外发布称，经国务院批准，同意设立合肥综合保税区，这也是安徽省获批的第一个综合保税区。在业内人士看来，合肥综合保税区获批，将为正在申请中的安徽自贸区增加一个重要砝码。因为，... ,http://stock.10jqka.com.cn/20140331/c564680098.shtml
2014-03-28 17:12,上港集团：投资收益或将推升14年业绩大幅增长,"公司披露2013年报:集装箱吞吐量增长3.8%至3377万标箱,散杂货吞吐量增长10.5%,实现业务收入人民币281.6亿元,同比下滑0.8%,营业利润同比增长6.7%至77亿,公司实现净利52.6亿元,同比增长5.8%,符合市场预期。集装箱吞吐量增速乏力:公司倚重集装箱... ",http://stock.10jqka.com.cn/20140328/c564663288.shtml
2014-03-28 14:16,上港集团(600018)：业绩稳定增长 看点在于改革和转型,"2013年公司散杂货吞吐量完成2.04亿吨(+10.5%);集装箱吞吐量完成3377.3万标准箱(+3.8%);实现营业收入281.62亿元(-0.77%),按同口径计算,营业收入同比增长2.9%;实现归属于上市公司股东的净利润52.56亿元(+5.76%)。实现EPS0.231元(+5.77%)。洋山... ",http://stock.10jqka.com.cn/20140328/c564654878.shtml
2014-03-28 14:16,上港集团(600018)：考虑土地价值后估值基本合理,"业绩与快报一致,符合预期上港集团（600018）2013年收入281.6亿元,同比下降0.8%,剔除合并范围变化影响后,收入同比增长2.9%。归属上市公司母公司净利润同比增长5.8%达52.6亿元,集装箱毛利56.7亿元,散杂货毛利6.5亿元,港口物流毛利8.2亿元,港口... ",http://stock.10jqka.com.cn/20140328/c564654954.shtml
2014-03-28 13:52,上港集团将探索混合所有制，多券商看好其改革进展,大智慧阿思达克通讯社3月28日讯，自去年自贸区之后，沪国资改革再度引发资本市场的强烈关注。上港集团（600018.SH）自去年受益自贸区概念热炒过后，又迎来市场对其国资改革概念的追捧。由于该集团早在2006年便实现了整体上市，因此资... ,http://www.gw.com.cn/news/news/2014/0328/200000328933.shtml
2014-03-28 09:32,上港集团去年利增5.76％，拟10派1.27元,大智慧阿思达克通讯社3月28日讯，上港集团（600018.SH）27日晚间公告，公司2013年实现营业收入281.62亿元，同比下降0.77%；归属于上市公司股东的净利润52.56亿元，同比增长5.76%；基本每股收益0.231元。同时，公司拟以2013年末公司总... ,http://www.gw.com.cn/news/news/2014/0328/200000328773.shtml
2014-03-28 09:30,中股业绩：上港集团去年实现净利润52.56亿元，同比增长5.76%,路透上海3月28日 - 中国最大港口企业--上海国际港务(集团)股份有限公司 周五公布，去年实现净利润5... ,http://cn.reuters.feedsportal.com/c/33087/f/535387/s/38b385bf/sc/3/l/0Lcn0Breuters0N0Carticle0CcompanyNews0CidCNL4S0AMP0AAI20A140A3280DfeedType0FRSS0GfeedName0FcompanyNews/story01.htm
2014-03-28 08:42,上港集团(600018)正式入股太仓港,太仓港通过此次合作将融入到上海国际航运中心的建设之中。图为太仓港港区。 本报资料图 本报记者欧莉通讯员明性 经过几年的谈判，上港集团（600018）和太仓港务集团终于达成协议，共同合作经营太仓港正和集装箱码头有限公司。据记者了解，上... ,http://stock.10jqka.com.cn/20140328/c564644517.shtml
2014-03-27 19:08,上港集团2013年净利润52.56亿元 增长5.76%,中证网讯 上港集团(600018) 3月27日晚间发布2013年年度报告，2013年公司实现营业收入281.62亿元，同比下降0.77%，公司实现归属于上市公司股东的净利润52.56亿元，同比增长5.76%。公司表示报告期内，生产经营实现“稳增长”的目标。公司完成母港货... ,http://stock.sohu.com/20140327/n397331683.shtml
2014-03-27 01:18,上港集团混合所有制改革先行：400亿国资将向投资者出售,21世纪经济报道 上海正在推进的混合所有制改革，让中国最大的港口企业上港集团（600018.SH）备受关注。3月24日，《新闻联播》用2分半钟的时间，对上海正在推行的国资混合所有制改革进行了报道。作为这一国资改革试点的代表，上港集团董... ,http://money.21cbh.com/2014/3-27/0OMDA2NzZfMTExMTI0OA.html
2014-03-26 08:26,上海国资改革全面推进 上港集团(600018)领衔上攻,异动表现：3月24日印发的《国务院关于进一步优化企业兼并重组市场环境的意见》提出，加快推进审批制度改革，取消下放部分审批事项，简化审批程序，优化相关审批流程，推行并联式审批。上市公司发行股份实施兼并事项，不设发行数量下限，兼并... ,http://stock.10jqka.com.cn/20140326/c564598340.shtml
2014-03-26 02:02,上海国企改革概念卷土重来 游资抢筹8股涨停,每经记者 唐强 在“京津冀一体化”题材的带动下，近期市场重燃 “炒地图”热情，先是热炒河北板块，之后又炒作北京、天津板块，昨日（3月25日）延伸至上海板块。《每日经济新闻》记者注意到，昨日上海国资改革概念股全线井喷，上港集团（60... ,http://www.nbd.com.cn/articles/2014-03-26/820387.html
2014-03-26 01:54,改革预期再度提振上港集团,沪深股市本周二维持震荡格局，但围绕自贸区炒作的热潮依旧，只是这次切换到了上海，上海自贸区指数昨日上涨4.75%，成为市场关注的热点。指数成分股中，上港集团（600018）开盘不久便涨停，股价报收于4.92元。昨日该股的成交额为3.24亿元，较... ,http://stock.10jqka.com.cn/20140326/c564597326.shtml
2014-03-25 14:54,中国银行上海分行正和上港集团商谈建跨境人民币双向资金池,大智慧阿思达克通讯社3月25日讯，近日，在上海国有资本运营研究院举办的一个沙龙上，中国银行上海市分行公司业务部总经理许建军许建军透露，中国银行正在和上港集团（600018.SH）商谈建立跨境人民币双向资金池。在这次沙龙上，上海市... ,http://www.gw.com.cn/news/news/2014/0325/200000327542.shtml
2014-03-18 13:58,上海国企分类确定：交运企业以功能类和竞争类为主,大智慧阿思达克通讯社3月18日讯，国资改革专家向大智慧通讯社表示，上海国企分类已经确定，上港集团（600018.SH）、交运股份（600676.SH）、锦江投资（600650.SH）将划入竞争类企业；上海机场（600009.SH）将划入功能类企业；申通地... ,http://www.gw.com.cn/news/news/2014/0318/200000325068.shtml
2014-03-18 12:12,(沪国资)上港集团酝酿混合所有制及全员持股计划,大智慧阿思达克通讯社3月18日讯，两会结束之后，上海国资改革再次升温，并引发更多关注，上港集团（600018.SH）作为上海国资企业之一，改革方向成为关注热点，作为已经在2006年实现整体上市的公司，其本月底即将上交的改革方案值得期待。**... ,http://stock.caijing.com.cn/2014-03-18/114017641.html
2014-03-11 07:12,上港集团陈戌源：进一步推进混合所有制改革,本报记者 官平 全国人大代表、上港集团董事长陈戌源10日向中国证券报记者表示，未来两年将进一步推进混合所有制改革，目前上港集团国有股成分达到90%，这个比例可以进一步完善和调整，非公部分还有很大提升空间。要完善法人治理结... ,http://finance.sina.com.cn/stock/s/20140311/023018466057.shtml
2014-03-10 20:50,上港集团3月底上报改革方案,根据新一轮上海国资国企改革的要求，3月底，上港集团、光明集团等国有企业都将上报其改革方案。根 据新一轮上海国资国企改革的要求，3月底，上港集团、光明集团等国有企业都将上报其改革方案。上海国际港务集团股份有限公司（600018）党委书记、董... ,http://www.yicai.com/news/2014/03/3563724.html
2014-03-06 09:50,上港集团倪路伦因工作需要辞去董事职务,中国网3月5日讯 上港集团5日晚间发布公告，公司董事会于2014年3月4日收到公司董事倪路伦的辞职报告。倪路伦先生因工作需要，申请辞去公司董事职务(同时自即日起将不再担任董事会下设预算委员会委员职务)。倪路伦辞去公司董事职务后... ,http://www.p5w.net/stock/news/gsxw/201403/t20140306_506317.htm
2014-01-27 05:20,上港46亿定增上海银行，自贸区打通贸易融资链,截至2013年年末，上海自贸区已经引进各类融资租赁母公司57家、项目子公司241个，租赁资产总值已超过55亿美元。理财周报记者 章银海/上海报道 日前，上海银行行长金煜透露，上海银行正在努力推进金融租赁公司的申报筹备，相关申请已经... ,http://finance.sina.com.cn/roll/20140127/051518092443.shtml
2014-01-23 11:42,上港集团：人事调整不影响公司正常运营,大智慧阿思达克通讯社1月23日讯，上港集团（600018.SH）内部人士向大智慧通讯社表示，公司副总裁及董秘的人员变动属于正常的岗位调整，不会影响公司的正常经营。上港集团1月22日晚间公告，董事会同意聘任倪路伦先生为公司副总裁，张... ,http://www.gw.com.cn/news/news/2014/0123/200000308791.shtml
2014-01-13 14:56,上港集团明确2014年重点工作，全面深化国企改革,大智慧阿思达克通讯社1月13日讯， 据上海市国资委官方网站周一消息显示，上港集团（600018.SH)明确2014年重点工作，努力实现四大突破，即全面深化国企改革、对接落实自贸区相关政策、加快发展港口商务地产以及积极推进国际化战略。据... ,http://www.gw.com.cn/news/news/2014/0113/200000304830.shtml
2014-01-08 09:02,借自贸区概念 上港集团(600018)市值翻番,本报记者杨珍莹浦东报道 作为中国唯一一家国家级航运交易所，上海航交所《航运交易公报》近日正式发布《2013年中国港航船企市值排行榜》，排行榜包含74家在内地、香港、台湾证券市场上市的主营业务为航运、港口、船舶及相关行业的上市公司，... ,http://stock.10jqka.com.cn/20140108/c563347944.shtml
2014-01-07 11:42,上港集团盘中拉升至涨停，或受益自贸区行政法规调整,大智慧阿思达克通讯社1月7日讯，7日（周二）上午10：38，上港集团（600018.SH）盘中突然拉升至涨停，而在涨停之前，中国政府网消息称国务院调整自贸区内19个行政法规。海通证券分析师向大智慧通讯社表示，上港集团涨停应该是受此消息... ,http://www.gw.com.cn/news/news/2014/0107/200000302572.shtml
2014-01-07 11:28,交通设施板块盘中大幅拉升涨3.62％,大智慧阿思达克通讯社1月7日讯，交通设施板块在经历了周一的大幅下挫后，周二迎来强势反弹。该板块周二低开高走，10:25突然大幅拉升，截至10:51，涨3.62%，位于沪深两市板块涨幅第二位。同期沪指涨0.05%，深成指涨0.13%。个股涨多跌... ,http://www.gw.com.cn/news/news/2014/0107/200000302562.shtml
2014-01-07 09:38,上港集团(600018)2013年实现净利52亿,上港集团（600018）今日发布业绩快报称，2013年公司净利52亿元，同比增长4.6%，每股收益0.23元，同比增长4.5%。分享到： 同花顺声明：本文转载上述内容出于传递更多信息之目的，不代表同花顺金融服务网的观点。文章内容仅供参考，不构成投资... ,http://stock.10jqka.com.cn/20140107/c563316054.shtml
2014-01-07 08:52,上港集团2013年净利润同比增4.6％至52亿,大智慧阿思达克通讯社1月7日讯，上港集团（600018.SH）6日晚间发布业绩快报，2013年度公司实现营业收入281亿元，同比下降1%；归属于上市公司股东的净利润52亿元，同比增长4.6%；基本每股收益0.23元。2013年，公司完成货物吞吐量5.42... ,http://www.gw.com.cn/news/news/2014/0107/200000302398.shtml
2014-01-06 23:52,上港集团2013年净利52亿元 同比增长4.6%,证券日报见习记者 苗可双 上港集团1月6日发布业绩快报，2013年公司营业收入为281亿元，同比下降1%，利润总额77亿元，同比增长7.1%，净利润52亿元，同比增长4.6%，每股收益0.23元，同比增长4.5%。2013年上港集团货物吞吐量5.42亿... ,http://www.ccstock.cn/gscy/gongsi/2014-01-06/A1389023081189.html
2014-01-06 21:58,[公司]上港集团2013年净利52亿 同比增长4.6%,全景网1月6日讯 上港集团（600018）周一晚间发布业绩快报称，2013年公司净利52亿元，同比增长4.6%，每股收益0.23元，同比增长4.5%。去年上港集团营业收入为281亿元，同比下降1%。快报显示，2013年上港集团货物吞吐量为5.42亿吨，同比增长7.... ,http://www.p5w.net/kuaixun/201401/t20140106_441368.htm
2014-01-06 11:48,交通设施板块盘中跌3.4％，个股全线下挫,大智慧阿思达克通讯社1月6日讯，交通设施板块继上个交易日收跌1.44%后，周一再度大幅走低。截至11:07，该板块跌3.4%，居于板块跌幅前五位；同期沪指跌2.32%，深成指跌2.84%。个股方面，全线下挫，其中湖南投资（000548.SZ）以6.35%的... ,http://www.gw.com.cn/news/news/2014/0106/200000302046.shtml
2014-01-02 10:18,2013年港航企业总市值大增，港口海工企业排名跃升,大智慧阿思达克通讯社1月2日讯，2014年1月2日，《航运交易公报》发布了《2013年中国港航船企市值排行榜》，列举了所有74家在中国大陆、香港和台湾证券市场上市的主营业务为航运、港口、船舶及相关行业的上市公司，并按照总市值大小进... ,http://www.gw.com.cn/news/news/2014/0102/200000300965.shtml
2014-01-02 08:58,上港集团(600018)借自贸区概念位列榜首,上海航运交易所《航运交易公报》昨天发布“2013年中国港航船企市值排行榜”，包括香港和台湾在内的74家中国港航造船类上市公司的总市值达9044.71亿元，较2012年增长20.2%，增加1507.82亿元，表明资本市场对此类上市公司的负面情绪有所缓解。... ,http://stock.10jqka.com.cn/20140102/c563183318.shtml
2014-01-02 08:52,上港集团总市值1190亿 港口海工完胜航运 “2013年中国...,核心提示： 根据上海航运交易所《航运交易公报》将于今日（1月2日）公布的《2013年中国港航船企市值排行榜》显示，所列举的74家在大陆、香港和台湾证券市场上市的主营业务为航运、港口、船舶及相关行业的上市公司，总市值约9044.71亿元。每... ,http://www.nbd.com.cn/articles/2014-01-02/799659.html
2013-12-26 23:32,国内外机构对城商行股权去留态度迥异,经济导报记者 姜旺 有人辞官归故里，有人星夜赶考场。最近一段时间，国内外机构对国内城商行股权去留态度迥异。目前来看，成交价格也差别巨大，外资折价撤退，国内机构却溢价四成认购。上港集团(600018)公告称，董事会已同意该... ,http://finance.sina.com.cn/china/jrxw/20131226/232817764131.shtml
2013-12-25 03:10,上海银行定增13.9元/股 H股全流通待破冰,本报记者陈植上海报道 从召开临时股东大会启动4 .7亿股定向增发方案到敲定主要投资者，上海银行耗时不到2个月时间。知情人士透露，上海银行内部已拟定一份定向增发投资者名单，除了出资46亿元的上海国际港务集团股份有限公司（下称上港集团，... ,http://finance.ifeng.com/a/20131225/11334583_0.shtml
2013-12-20 15:26,上港集团是否第一批划给上海国资管理公司尚未确定,大智慧阿思达克通讯社12月20日讯，据接近上港集团（600018.SH）的人士向大智慧通讯社表示，目前有听说上港集团可能作为第一批划转给上海国有资本管理有限公司的企业，但是最终是否能够作为第一批进入尚不确定。上海国际航运研究中心... ,http://www.gw.com.cn/news/news/2013/1220/200000297239.shtml
2013-12-17 15:32,(国资)分析认为上港集团参与国资改革程度较有限,大智慧阿思达克通讯社12月17日讯，上海国资改革酝酿已经多时，改革方案今日出台。上港集团（600018.SH）作为上海国资企业之一，改革方向成为关注热点，但是作为已经在2006年实现整体上市的公司，两家券商分析师向大智慧通讯社表示，... ,http://www.gw.com.cn/news/news/2013/1211/200000293493.shtml
2013-12-17 11:01,(国资)专家：上港集团和交运股份等将划入竞争类企业,大智慧阿思达克通讯社12月17日讯，国资改革专家向大智慧通讯社表示，就交通运输行业而言，上港集团（600018.SH）、交运股份（600676.SH）、锦江投资（600650.SH）将划入竞争类企业。对于竞争类的企业，激励空间会更大，未来的发展空... ,http://www.gw.com.cn/news/news/2013/1217/200000295484.shtml
2013-12-10 08:36,上港集团(600018)拟46亿入股上海银行,青年报记者陈颖婕 本报讯上港集团（600018）昨日晚间公告称，上海银行拟向特定对象定向发行人民币普通股，公司拟以现金形式认购上海银行此次发行的部分股份，认购总金额不超过46亿元。同时，公司同意上海冠东国际集装箱码头有限公司向银行申... ,http://stock.10jqka.com.cn/20131210/c562670043.shtml
2013-12-10 02:08,上港集团拟斥资46亿 认购上海银行增发股,距离上海银行临时股东大会通过定向增发决议仅不到一个月，拟认购对象就开始浮出了水面。上港集团（600018）昨晚发布公告，董事会已同意该集团以现金形式认购上海银行定向增发的部分股份，认购总金额不超过46亿元人民币。董事会同意授权集团总... ,http://stock.10jqka.com.cn/20131210/c562664216.shtml
2013-12-10 01:20,上港集团46亿元认购上海银行定增 自贸区港口与金融联系加深,每经记者 戴榆 发自上海 上港集团（600018，SH）昨日（12月9日）晚间发布公告，将以现金形式认购上海银行股份有限公司（以下简称上海银行）的定向增发股份，总金额不超过46亿元人民币，认购金额占上港集团2012年49.7亿元净利润的92.5... ,http://finance.sina.com.cn/roll/20131210/011317579395.shtml
2013-12-09 17:44,上港集团(600018)拟不超46亿认购上海银行股份,上港集团（600018）12月9日晚间公告，上海银行拟向特定对象定向发行人民币普通股，公司拟以现金形式认购上海银行此次发行的部分股份，认购总金额不超过46亿元。同时，公司同意上海冠东国际集装箱码头有限公司向银行申请借款，借款额度不超过4... ,http://stock.10jqka.com.cn/20131209/c562654570.shtml
2013-12-05 09:04,金改时间表再推自贸区概念股井喷 五个月涨182%,昨日，受央行连续两天出台利好政策影响，上海自贸区概念股大涨，根据昨日收盘价计算，7月以来，上海物贸、外高桥涨幅分别达到182%和149%；陆家嘴、上港集团涨幅也超过70%。事实上，把自贸区板块称为今年下半年“最牛板块”一点不为过 新京... ,http://stock.caijing.com.cn/2013-12-05/113650206.html
2013-12-04 11:34,上海自贸区概念涨幅扩大 上港集团等7股涨停,上海自贸区概念集体爆发，上港集团、陆家嘴、浦东金桥、外高桥、上海物贸、东方创业、华贸物流等7股涨停，锦江投资涨9.36%，概念板块个股全线上涨。新浪声明：此消息系转载自新浪合作媒体，新浪网登载此文出于传递更多信息之目的... ,http://finance.sina.com.cn/stock/jsy/20131204/113017525838.shtml
2013-12-04 10:28,快讯：上海自贸区股涨 上港集团涨停,新浪提示：本文属于个股点评栏目，仅为证券咨询人士对相关个股或板块的个人观点和分析，并非正式的新闻报道，新浪不保证其真实性和客观性，投资者据此操作，风险自担。一切有关该股的准确信息，请以沪深交易所的公告为准。受央行加... ,http://finance.sina.com.cn/stock/e/20131204/102417525041.shtml
2013-12-03 10:48,沪深300调换21只样本股 并非“养老院” 而是牛股“中转站”,上交所和中证指数公司昨日同时发布公告，对上证50、中证500等多只重要指数进行样本股调整，其中沪深300指数更换21只样本股。本次样本股调整将提前到12月16日正式生效。沪深300指数“换血” 在本次样本股调整中，沪深300指数更换21只股票，上... ,http://stock.10jqka.com.cn/20131203/c562488702.shtml
2013-11-29 13:11,宁波港上港集团参股保险公司总部选址宁波,大智慧阿思达克通讯社11月29日讯，中国人保某高管周四向大智慧通讯社表示，中国人保、宁波港（601018.SH）与上港集团（600018.SH）共同设立的航运保险公司总部将设立于宁波。上述人士称，此次航运保险公司的成立主要是由宁波港牵头，... ,http://www.gw.com.cn/news/news/2013/1129/200000289394.shtml
2013-11-28 16:03,上港集团：自贸区立足长远 低增速时代稳前行,"事件: 近期,我们对公司进行了调研,就自贸区、国企改革、营改增等投资者关注的问题与公司进行了深入的交流。评论: 1、自贸区影响应着眼中长期。个人理解自贸区是政府职能转变和政府监管理念的重大创新,从事前的监管转向事中事后的审查,看似放... ",http://stock.10jqka.com.cn/20131128/c562428312.shtml
2013-11-23 10:43,上海港口举行设施安保演习,本报讯(记者任翀通讯员史一奇)昨天上午，2013年上海港口设施安保演习暨罗泾港区区域安保联动演习在上港集团（600018）罗泾分公司码头举行。整个演习时长约60分钟。罗泾港区位于长江口南岸，是上海港规模最大、设施最新的散货杂作业港区。此次... ,http://stock.10jqka.com.cn/20131123/c562370787.shtml
2013-11-22 14:04,上港集团：为投资者提供机会分享增长成果,“自上市以来，上港集团每年都将当年利润中不少于50%的可分配利润向股东进行分配，并已累计现金分红达156亿元人民币。公司希望随着企业的不断成长和发展，给予投资者合理的投资回报，为投资者提供分享经济增长成果的机会。”在日前... ,http://www.p5w.net/stock/news/gsxw/201311/t20131122_388143.htm
