datetime,title,content,url
2018-09-06 22:55,黄浦江边故事 上港集团60亿元接盘星外滩未满一年欲转手,这里有闻名世界的外滩，东方明珠塔和金茂大厦遥遥相对，霓虹闪烁，数十栋造型现代化、错落分布的甲级写字楼昂首屹立于黄浦江北岸。 星外滩，位于上海虹口区南部滨江区域，西连老外滩商业中心，南望陆家嘴金融中心，坐拥黄浦江黄金... ,"http://finance.eastmoney.com/news/1354,20180906941466754.html"
2018-09-06 17:31,上港集团拟挂牌出售上海星外滩100%股权 净资产近60亿元,上港集团发布公告称，拟在产权交易所预挂牌出售全资子公司星外滩100％股权，星外滩7月末净资产为59.48亿元。 观点地产网讯： 9月6日，上港集团发布公告称，拟在产权交易所预挂牌出售全资子公司星外滩100％股权，星外滩7月末净资产为59.48亿... ,http://www.guandian.cn/article/20180906/207352.html
2018-09-06 17:15,上港集团：预挂牌出售上海星外滩开发建设100%股权,摘要 【上港集团：预挂牌出售上海星外滩开发建设100%股权】上港集团(600018)9月6日晚间公告，拟在上海联合产权交易所预挂牌，出售全资子公司上海星外滩开发建设有限公司100%股权。截至2018年7月31日，预公开挂牌出售公司星外滩资... ,"http://finance.eastmoney.com/news/1354,20180906941335082.html"
2018-09-06 16:54,上港集团拟出售星外滩100%股权,上港集团(沪：600018)发布公告指，拟在产权交易所 预挂牌出售全资子公司星外滩100%股权。星外滩7月末净资产59.48亿元人民币。 上港集团指，本次出售股权有利于进一步推进产业布局调整，优化资源配置，对上市公司本 年度利润会有一... ,"http://finance.eastmoney.com/news/1354,20180906941319389.html"
2018-07-25 16:47,上港集团向子公司瑞祥房地产增资16.5亿元,7月25日，上海国际港务(集团)股份有限公司发布公告称，公司第二届董事会第六十七次会议审议通过了包括《关于向上港集团瑞祥房地产发展有限责任公司增资的议案》在内的三项议案。 据观点地产新媒体查阅，《关于向上港集团瑞祥房地... ,"http://finance.eastmoney.com/news/1354,20180725913099146.html"
2018-07-25 16:33,7月25日上市公司晚间公告速递,大西洋：上半年净利预增90%到110% 大西洋（600558）7月25日晚间公告，预计今年上半年实现的净利润与上年同期相比，将增加2000万元到2500万元，同比增加90%到110%。业绩增长主要原因是处置土地收益和投资成都坦途置业有... ,http://finance.sina.com.cn/stock/s/2018-07-25/doc-ihfvkitw4235773.shtml
2018-07-25 16:00,上港集团：向子公司瑞祥房地产增资16.5亿元,上港集团(600018)7月25日晚间公告，公司将向全资子公司上港集团瑞祥房地产发展有限责任公司增资16.5亿元，增资后瑞祥公司注册资本由5亿元增加至21.5亿元。 (责任编辑：DF381) ,"http://finance.eastmoney.com/news/1354,20180725913046736.html"
2018-07-16 08:36,上港集团：加固世界第一大集装箱港口地位,证券时报记者 王一鸣 开埠至今已步入第175个年头的上海港，位于中国大陆东海岸的中部、“黄金水道”长江与沿海运输通道构成的“T”字形水运网络的交汇点，前通中国南、北沿海和世界各大洋，后贯长江流域及江、浙、皖内河和太湖... ,http://www.p5w.net/stock/news/gsxw/201807/t20180716_2158810.htm
2018-07-16 07:22,迎接新一轮对外开放上港集团扬帆再起航,华创证券 吴一凡 上港集团（600018）主营业务包括集装箱码头、散杂货码头、港口物流业务和港口服务业务四大板块，目前已形成了包括码头装卸、仓储堆存、航运、陆运、代理等服务在内的港口物流产业链。 从财务数据上看，2017年公司实现营业收... ,http://stock.10jqka.com.cn/20180716/c605687023.shtml
2018-07-16 06:51,百年老港上港集团再出发：要做全球卓越的码头运营商和港口物流服务商,官兵/制图 证券时报记者 王一鸣 港为城用，城以港兴，上海之所以能够获得如今的国际大都市地位，港口对这座城市发展的意义不言而喻。 开埠至今已步入第175个年头的上海港，位于中国大陆东海岸的中部、“黄金水道”长江与沿海运输通道... ,http://sc.stock.cnfol.com/ggzixun/20180716/26662031.shtml
2018-07-15 18:42,采访札记丨上港集团：老码头闯出新天地,上海老电影里经常出现老码头的桥段，一群精壮大汉在车水马龙的港口搬运来自天南海北的货物，也把汇集与此的各色器物发往五湖四海……前往上港集团进行“上市公司高质量发展在行动”采访，虽然已经在心里对这家企业较之老电影里的港口... ,http://sc.stock.cnfol.com/ggzixun/20180715/26661823.shtml
2018-06-04 20:53,上海银行获主要股东增持,4日晚间，上海银行发布关于稳定股价措施实施进展的公告显示，增持计划的实施进展情况为，2018年5月31日至2018年6月1日，上港集团以自有资金，通过上海证券交易所交易系统以集中竞价的方式累计增持上海银行股份1487100股，占该公司总股本的0.... ,http://stock.stockstar.com/SS2018060400001327.shtml
2018-05-28 20:00,上海银行“保价”方案出台 三股东拟增持,上海银行的“保价”方案出台，5月28日晚间披露稳定股价措施，公司持股5%以上的股东联和投资、上港集团和桑坦德银行决定未来6个月内增持公司股份，拟增持的金额均不低于触发日前最近一个年度其自公司获得现金分红总额的15%。 其中... ,"http://finance.eastmoney.com/news/1354,20180528878830096.html"
2018-05-28 19:27,上海银行：三大股东拟6个月内增持股份 不设价格区间,"上海银行(601229,诊股)公布稳定股价措施，股东联和投资、上港集团(600018,诊股)和桑坦德银行决定未来6个月内增持公司股份，拟增持的金额均不低于触发日前最近一个年度其自公司获得现金分红总额的15%。 其中，联和投资、上港集团、上港集团本... ",http://stock.jrj.com.cn/2018/05/28192524600949.shtml
2018-05-28 18:47,上海银行披露稳定股价措施 三名股东拟增持,摘要 【上海银行披露稳定股价措施三名股东拟增持】上海银行(601229)5月28日晚间披露稳定股价措施，公司持股5%以上的股东联和投资、上港集团和桑坦德银行决定未来6个月内增持公司股份，拟增持的金额均不低于触发日前最近一个年度其... ,"http://finance.eastmoney.com/news/1354,20180528878815430.html"
2018-05-28 18:37,上海银行：股东拟6个月内增持公司股份，不设价格区间,"每经编辑林静 上海银行公布稳定股价措施：公司持股5%以上的股东联合投资、上港集团、桑坦德银行6个月内拟增持的金额均不低于触发日前最近一个年度其自本公司获得现金分红总额的15%。其中，联和投资本次拟增持的金额不少于5,990万元，上港... ",http://www.nbd.com.cn/articles/2018-05-28/1221252.html
2018-05-23 22:44,收盘价连续低于每股净资产 上海银行触发稳定股价措施,"面对自家股票价格持续低迷，不少上市银行股东选择增持，上海银行(601229,诊股)就是其中一家。 5月20日，上海银行发布公告称，作为该行持股5%以上的第二大股东——上海国际港务（集团）股份有限公司（下称“上港集团(600018,诊股)”）于 5 月... ",http://stock.jrj.com.cn/2018/05/23223924581511.shtml
2018-05-23 10:12,上港集团持上海银行股份比重升至6.73%,5月20日，上海银行发布公告称，该行股东上海国际港务(集团)股份有限公司(简称“上港集团”)于2018年5月8日至2018年5月18日，通过上海证券交易所交易系统以集中竞价交易方式增持了该行股份19572342股，占该行总股本的0.25%，合计增持金... ,http://sc.stock.cnfol.com/ggzixun/20180523/26460787.shtml
2018-05-23 07:11,新上市银行大股东增持:股价稳定机制藏估值修复预期,本文作者：面包财经 上周末，两家新上市的城商行——上海银行（601229.SH）和江苏银行（600919.SH）先后发布了大股东增持的公告，引发市场对于银行股估值修复的探讨。 先来看看公告情况。 上海银行5月20日... ,http://finance.sina.com.cn/stock/marketresearch/2018-05-23/doc-ihawmauc2124562.shtml
2018-05-21 14:25,上海银行：股东上港集团耗资逾3亿元增持公司股份,上海银行(601229)5月20日晚间公告，基于对公司未来发展前景的信心，公司股东上港集团(600018)于5月8日至5月18日通过集中竞价增持公司股份1957.23万股，占公司总股本的0.25%，合计增持金额约3.04亿元，增持资金来源为自有资金。增... ,"http://finance.eastmoney.com/news/1354,20180521874980115.html"
2018-05-21 08:28,周末重要增减持公告:普洛药业控股股东小幅增持至50%,"上海银行(601229,诊股)获股东上港集团(600018,诊股)增持0.25%股份 上海银行公告，公司股东上港集团于2018年5月8日至2018年5月18日，通过上海证券交易所交易系统以集中竞价交易方式增持公司股份19,572,342股，占公司总股本的0.25%，合计增持... ",http://stock.jrj.com.cn/2018/05/21081924566044.shtml
2018-05-21 06:46,上海银行股份有限公司关于股东增持本公司股份的公告,（原标题：上海银行股份有限公司关于股东增持本公司股份的公告） 本公司董事会及全体董事保证本公告内容不存在任何虚假记载、误导性陈述或者重大遗漏，并对其内容的真实性、准确性和完整性承担个别及连带责任。 重要内容提示： 本公司股东上... ,http://stock.stockstar.com/SS2018052100000120.shtml
2018-05-21 05:51,上港集团3.04亿元增持上海银行 持股比例为6.73%,上海银行(601229)5月20日晚间公告称，该行第二大股东上港集团5月8日至18日以自有资金通过公开市场增持1957万股，增持金额3.04亿元。增持完成后，上港集团合计持有上海银行5.25亿股，持股比例由6.48%提升至6.73%。根据公告，上港集... ,"http://finance.eastmoney.com/news/1354,20180521874659537.html"
2018-05-20 20:26,又一上市城商行主要股东增持，上港集团对上海银行持股比例升至6.73%,上海银行5月20日公告称，该行第二大股东上港集团5月8日至18日以自有资金通过公开市场增持1957万股，增持金额3.04亿元。增持完成后，上港集团合计持有上海银行5.25亿股，持股比例由6.48%提升至6.73%。 根据公告，上港集团是基于对上海银行... ,http://www.nbd.com.cn/articles/2018-05-20/1218814.html
2018-05-20 17:26,上海银行获股东上港集团增持0.25%股份,"中国证券网讯（记者 骆民）上海银行公告，公司股东上港集团于2018年5月8日至2018年5月18日，通过上海证券交易所交易系统以集中竞价交易方式增持公司股份19,572,342股，占公司总股本的0.25%，合计增持金额约3.04亿元。增持之... ",http://finance.sina.com.cn/roll/2018-05-20/doc-ihaturft2884328.shtml
2018-04-09 08:25,本周股评家最看好的个股,7人次推荐：（2只） 上港集团（600018） 倍 加 洁（603059） 6人次推荐：（14只） 五矿发展（600058） 上海家化（600315） 通威股份（600438） 欧普照明（603515） 美的集团（000333） 小天鹅A（000418） 京新药业（002020） ... ,http://www.p5w.net/stock/news/zonghe/201804/t20180409_2105495.htm
2018-03-28 21:03,上港集团2017年实现净利润115.36亿元 同比增长66%,3月27日晚间，上港集团（600018）披露年报，2017年公司实现营业收入374.24亿元，同比增加19.34%，实现归属于上市公司股东的净利润115.36亿元，首次突破百亿元，同比增加66.25%。公司年报拟10派1.72元。 年报显示，报告期内，2017年，公司母港集... ,http://company.stcn.com/2018/0328/14066814.shtml
2018-03-27 21:56,上港集团年赚115.36亿 上港足球队全年净赚5000万,来源：航运界 航运界网28日消息， 上港集团 （600018）发布2017年财报，该集团2017年营业收入为374.24亿元，较去年同期增长19.34%；归属上市公司股东净利润为115.36亿元，较去年同期增长66.25%。 据航运界网监测，上港... ,http://finance.sina.com.cn/stock/s/2018-03-27/doc-ifysqfnh5921711.shtml
2018-03-16 00:34,外企中国路｜日媒：日通与上港集团合作全面开拓中国客户,参考消息网3月16日报道 日媒称，日本通运（简称日通，NIPPON EXPRESS）与中国最大的港口公司上海国际港务集团（SIPG）开始了合作，将利用连接上海和内陆城市的上港集团内航船等，在中国拓展运输网。此前，日通在中国一直以日本企... ,http://news.sina.com.cn/o/2018-03-16/doc-ifyshwvv8770289.shtml
2018-02-01 20:48,方怀瑾：上港集团下一步要开发小洋山北侧,中国证券网讯（记者 宋薇萍）上海国际港务（集团）股份有限公司副总裁方怀瑾2月1日在2017暨第八届上海国资高峰论坛上透露，上海自由贸易港政策的主要载体就在洋山，上港集团已经和浙江方面达成了更加深入的合作意向，下一步要开发小洋山北侧... ,"http://news.cnstock.com/news,bwkx-201802-4183923.htm"
2018-01-17 15:20,金茂新局与引入嘉里 大股东折让配股33亿的资本斟酌,来源：观点地产网 作者：陈朗洲 4天前，惯常“年末卖楼”的金茂，由出售资产到不放弃优先购买，花费近29亿元将上港集团星外滩两公司剩余50%股权收入囊中。 中国金茂这一反常举动还未令市场完全消化，1月15... ,http://finance.sina.com.cn/stock/hkstock/ggscyd/2018-01-17/doc-ifyquixe3141286.shtml
2018-01-12 20:07,上港集团年报净利增长66%,中国证券网讯（记者 孔子元）上港集团12日晚间发布业绩快报，2017年，公司营业收入373.3亿元，同比增长19%；归属于上市公司股东的净利润115.3亿元，同比增加66.1%，基本每股收益增加66.1%，主要是：一方面，2017年公司母港... ,http://ggjd.cnstock.com/company/scp_ggjd/tjd_ggkx/201801/4175432.htm
2018-01-02 19:46,上港集团：依托华为云实现海量数据互通与交换,摘要： 海勃物流采用华为云技术完成了上海国际港务集团港航纵横平台的建设，解决了当前航运业面临的海量数据的查询与互通难题，得到了客户的一致好评。 海勃物流采用华为云技术完成了上海国际港务集团“港航纵横平台”的建设，解决了当前航运... ,http://www.csdn.net/article/a/2018-01-02/15939201
2017-12-29 12:15,上港集团(600018-CN)斥近60亿受让中国金茂(00817-...,路透上海12月29日电， 中国上海国际港务(集团)股份有限公司(600018-CN)周四晚公告称，近日公司以59.98亿元人民币价格，在上海联合产权交易所公开摘牌受让中国金茂(00817-HK)间接持有的上海星外滩开发建设公... ,http://finance.sina.com.cn/stock/hkstock/ggscyd/2017-12-29/doc-ifyqcsft7931673.shtml
2017-12-29 09:24,[港股]中国金茂59.98亿元售上海星外滩50%股权,全景网12月29日讯 中国金茂（00817.HK）周四晚间公布，上港集团透过产权交易所举办的公开挂牌程序，以人民币59.98亿元的代价，投得上海星外滩50%的股权。于2017年12月28日，公司全资附属公司威旺置业与上港集团就出售事项订立产权交易合... ,http://www.p5w.net/kuaixun/201712/t20171229_2053952.htm
2017-12-28 20:49,中国金茂(00817-HK)以59.98亿元出售上海星外滩50%股权,中国金茂(00817-HK)公布，兹提述公司2017年11月21日的公告，内容有关集团拟透过产权交易所举办的公开挂牌程序，出售其于上海星外滩50%的股权。 董事会宣布，上港集团透过产权交易所举办的公开挂牌程序以人... ,http://finance.sina.com.cn/stock/hkstock/ggscyd/2017-12-28/doc-ifyqchnr6914434.shtml
2017-12-28 20:39,中国金茂(00817)以59.98亿元向上港集团出售上海星外滩50%股权,智通财经APP讯，中国金茂(00817)公布，上港集团透过产权交易所举办的公开挂牌程序以人民币约59.98亿元的代价投得上海星外滩50%的股权。于2017年12月28日，该公司全资附属公司威旺置业与上港集团就出售事项订立产权交易合同。 于公告之日... ,https://www.zhitongcaijing.com/content/detail/98559.html
2017-12-28 19:26,上港集团近60亿元拍得上海星外滩50%股权,"中国证券网讯（记者 孔子元）上港集团28日晚间公告，公司通过上海联合产权交易所公开摘牌受让上海星外滩开发建设有限公司50%股权，成交价格为人民币5,998,007,350元。星外滩主要负责在上海市虹口区海门路55号地块内从事商业... ",http://ggjd.cnstock.com/company/scp_ggjd/tjd_ggkx/201712/4169888.htm
2017-12-09 08:06,上港将“爱心”送至贵州兴义 青训基地已多达44家,结束了本赛季的三线作战，上海上港集团足球俱乐部在青训体系建设的脚步依旧忙碌。今天（12月8日），上港足球俱乐部贵州兴义青少年足球培训基地授牌及捐赠仪式，在贵州省兴义市兴义中学举行。至此，自2015年11月开始，经过将近两年... ,http://news.sina.com.cn/o/2017-12-09/doc-ifypnqvn1939228.shtml
2017-11-22 07:06,中国金茂60亿出售星外滩50%股权,⊙记者 朱楠 ○编辑 全泽源 昨天，中国金茂发布公告称，已就出售上海星外滩开发建设有限公司(简称“星外滩”)50%股权的事项于上海联合产权交易所正式披露。根据上海联合产权交易所的信息显示，该标的挂牌价为59.98亿元。11月18日，上港... ,http://stock.10jqka.com.cn/hks/20171122/c601688704.shtml
2017-11-20 11:44,上港集团：拟出售国航公司及银汇公司各50%股权,据11月18日上港集团公告，上海国际港务（集团）股份有限公司（以下简称：“上港集团”）拟将所持上海国际航运服务中心开发有限公司（以下简称：“国航公司”）、上海银汇房地产发展有限公司（以下简称：“银汇公司”）各50%的股... ,http://www.ccstock.cn/gscy/gongsi/2017-11-20/A1511147930474.html
2017-11-08 17:52,关于同意上港集团物流有限公司成为上海期货交易所...,你公司报送的《上港集团物流有限公司关于拟成为螺纹钢与热轧卷板期货指定交割仓库的申请》收悉。根据《上海期货交易所指定交割仓库管理办法》等有关规定，现批复如下： 一、同意你公司成为我所螺纹钢和热轧卷板期货指定交割仓库的申请，... ,http://news.mysteel.com/17/1108/17/409B5F16E8F88B32.html
2017-10-24 16:53,中远海控要约收购东方海外完成美国反垄断审查,10月23日，中远海控（601919）发布重大资产重组进展公告，截至目前，公司拟通过境外全资子公司Faulkner Global Holdings Limited与联合要约人上港集团（600018）BVI发展有限公司联合向香港联交所上市公司东方海外(国际)有限公司的要约收购涉... ,http://stock.10jqka.com.cn/20171024/c601068645.shtml
2017-10-24 10:04,自由港概念股开盘分化 两股涨停,自由港概念股开盘分化，畅联股份（603648）、中远海科（002401）继续涨停，华贸物流（603128）冲板回落，但上海临港（600848）、锦江投资（600650）、上港集团（600018）、锦江投资均跌逾4%。 作为未来5年我国在全面开放领域再上一个台阶的... ,http://stock.10jqka.com.cn/20171024/c601052139.shtml
2017-10-17 07:22,上港集团“长江战略”进入收获期,⊙记者 宋薇萍 王宙洁 ○编辑 林坚 上海国际港务集团副总裁丁向明近日接受上证报记者专访，就该集团“长江战略”进行了全面阐述。他告诉记者，上港集团（600018）今年1月至8月集装箱业务量增长8.3%，其中，长江流域集装箱业务量一直保持较好... ,http://stock.10jqka.com.cn/20171017/c600837548.shtml
2017-09-13 17:41,A股并购重组“严把关” 产业整合获政策护航,今年以来，监管层多次表态“规范和支持上市公司并购重组”，这一监管态度在证监会网站最新发布的《上市公司并购重组服务实体经济转方式调结构取得明显成效》一文再次得到确认。 该文称，证监会通过大力推进并购重组市场化改革，扎实开展... ,http://www.zhitongcaijing.com/content/detail/80468.html
2017-08-29 18:31,上港集团：上半年净利同比增16% 证金公司小幅增持,上港集团(600018)8月29日晚披露半年报，公司上半年营收为167亿元，同比增长8.45%；净利为33.73亿元，同比增长15.62%；基本每股收益0.1455元。从前十大股东持股变动来看，证金公司二季度增持1.87亿股，持股比例由一季度末的2.66%上升至二季度... ,http://stock.stockstar.com/SS2017082900005647.shtml
2017-08-07 11:54,东方海外(00316-HK)董立新：与中远海控(01919-HK)...,上月初，中远海控(01919-HK) (601919-CN)及上港集团(600018-CN)以每股78.67港元现金价向东方海外国际(00316-HK)股东发出附先决条件自愿性全面要约，全数收购东方海外国际已发行之股票。交易完成后，中远海... ,http://finance.sina.com.cn/stock/hkstock/ggscyd/2017-08-07/doc-ifyitayr9527915.shtml
2017-07-28 13:30,上港集团足球俱乐部与TUV莱茵签署「Pro-Solutions」合作协议,香港2017年7月28日电 /美通社/ -- 2017年7月21日，上海上港集团足球俱乐部(以下简称「上港俱乐部」)和德国莱茵TUV 集团(以下简称「TUV莱茵」)在上海签署 「Pro-Solutions」 职业化运营合作协议，标志著 TUV... ,http://www.quamnet.com/newscontent.action?articleId=5319560&listSectionCode=NEW_HOT
2017-07-24 14:30,溢价收购东方海外 中远海控H股涨10%,7月24日，中远海控(01919.HK)H股拉升上涨，盘中最高价4.77港元，涨近10%，股价创本轮反弹新高。A股目前依然处于停牌中。 此前中远海控联合上海国际港务股份有限公司向东方海外有限公司联合公布，中远海控及上港集团对东方海外以31%溢价、总... ,http://stock.stockstar.com/SS2017072400000692.shtml
2017-07-12 10:04,《A股焦点》标普称参与收购东方海外不影响评级，上港集团微升,《经济通通讯社12日专讯》评级机构标普表示，上港集团（沪：600018）拟收购东 方海外（00316）9．9％股份的交易，不影响上港集团的自身评级。 上港集团股价现升0．15％，报6．57元人民币 标普认为，此次收购是上港集团为深化与主要航运公... ,http://news.etnet.com.cn/all-jishixinwen/270712823.htm
2017-07-11 05:46,中远海控429亿“吃进”东方海外 集运业迈向寡头时代,7月9日晚间，中远海控（601919）(01919.HK)发布公告，确认了市场疯传已久的消息——并购东方海外。公告披露，本次收购由中远海控和上港集团（600018）共同操刀，收购东方海外货柜航运公司的母公司东方海外国际有限公司(HK.00316)，据称两家... ,http://stock.10jqka.com.cn/20170711/c599161583.shtml
2017-07-10 21:38,中远海控拟492亿港元要约收购东方海外,（原标题：中远海控拟492亿港元要约收购东方海外） 7月9日晚间，中远海控(601919)、上港集团(600018)及东方海外(0316.HK)联合公告，中远海控及上港集团将以每股港币78.67元向东方海外全体股东发出附先决条件的自愿性全面现金收购要约(简称“... ,http://stock.stockstar.com/SS2017071000005598.shtml
2017-07-10 21:33,航运业年内最大并购：中远海控购东方海外美国市场份额或倍增,本报记者 矫月 2017年7月9日晚，中远海运集团下属中远海运控股股份有限公司（以下简称：中远海控），上海国际港务（集团）股份有限公司（以下简称：上港集团）及东方海外（国际）有限公司（以下简称：东方海外）联合公布，中远... ,http://www.ccstock.cn/gscy/gongsi/2017-07-10/A1499692559788.html
2017-07-10 15:09,《大行报告》花旗料东方海外成并购交易最受惠者 ...,显示: 股价升跌 沽空资料 花旗发表的报告指，中远海控(01919.HK) +0.190 (+4.668%) 沽空 $6.40百万; 比率 1.974% 联同A股上港集团(600018.SH)提出以溢价31.1%收购东方海外(00316.HK) +11.500 (+19.167%) 沽空 $5.04... ,http://www.aastocks.com/sc/stocks/news/aafn-content/NOW.813087/popular-news
2017-07-10 10:18,《A股焦点》夥中远海控收购东方海外，上港集团股价升逾1％,《经济通通讯社10日专讯》中远海控（01919）（沪：601919）联同上港集团 （沪：600018），提出以492．3亿港元收购东方海外（00316），每股作价 78．67港元，较东方海外前收市价溢价31．1％。中远海控收购东方海外后或将成为全球 第三大航... ,http://news.etnet.com.cn/all-jishixinwen/270710823.htm
2017-07-10 10:15,中远海运联合上港集团近430亿收购东方海外,中远海运联合上港集团近430亿收购东方海外丨航运界 都说航运是冒险家的天堂。而整合、市场化的商业行为一直是航运业的胜利法则。诚如业界已广泛知晓的那样，中远海运和东方海外“在一起”了；但和之前各媒体披露的情况有所不同，即上港集团也参与了... ,http://finance.qq.com/a/20170710/016306.htm
