datetime,title,content,url
2015-05-11 11:58,日照港争取蒙古国出海口已获山东高层支持,鸡毛信jmxer5月11日上午盘中消息：鸡毛信jmxer（微信：jmxer-vip）上午刚刚了解到的消息显示，山东发改委已上报《关于日照港争取蒙古国出海口有关情况》请示，目前该请示已得到山东最高层的批示和支持。鸡毛信jmxer（微信：jmxer-vip）了解，该... ,http://stock.caijing.com.cn/20150511/3879438.shtml
2015-04-30 05:46,“全天候”把关进口铁矿煤炭质量,"日照检验检疫局化矿检验查验科,现有工作人员35名,他们中的大部分人常年驻扎在日照港口作业一线,肩负着日照港进口煤炭、矿石等大宗散货检验监管工作。由于担任的职责不同,尘土、矿石粉末飞扬,是他们工作环境的一部分。随着日照港的发展壮... ",http://info.glinfo.com/15/0430/05/CE4232D2295CAFA6.html
2015-04-13 08:10,(数据)本周限售股解禁市值848亿元，京东方A解禁市值最高,大智慧阿思达克通讯社4月12日讯，本周（4月13日至4月17日）沪深两市限售股解禁数量共计132.60亿股，以上周五收盘价计算，解禁市值848.09亿元。而这其中，京东方A（000725.SZ）以502.33亿元解禁市值居首（解禁股数也是最大），此外日... ,http://www.gw.com.cn/news/news/2015/0412/200000426573.shtml
2015-04-11 11:44,七公司定增股将上市流通,本报讯(记者 陈慧)统计显示，下周限售股数量有132.5亿股，以周五收盘价计算，市值为846.23亿元，共涉及14只个股。京东方A将解禁118.48亿股，市值超过500亿元，解禁股份类型为定向增发机构配售股。作为4月份解禁最大的一只个股，其走势尤为市... ,http://stock.10jqka.com.cn/20150411/c571700273.shtml
2015-03-30 09:16,港达船舶创新生产模式,作为一家传统的造船企业，日照港达船舶重工有限公司积极创新生产管理模式，开拓新业务，企业效益实现逆势上扬。日前，日照港达船舶建造的光汇326号油轮的船体制造完成并下水，进入内部各种船舶设备的安装与调试阶段。再过一个多月，它... ,http://finance.glinfo.com/15/0330/09/1A2302AC20B4C691.html
2015-03-23 22:58,日照港去年净利减28.6% 拟10派0.4元,日照港（600017）周一晚间发布年度报告称，公司2014年实现净利润5.73亿元，较上年减少28.61%；每股收益0.186元。公司拟以公司总股本为基数，向全体股东按每10股派现金红利0.4元（含税）。期内公司营业收入50.84亿元，同比增长2.38%。日照港表示，2014... ,http://finance.qq.com/a/20150323/092323.htm
2015-03-23 22:56,日照港：第五届董事会第六次会议决议公告,日照港（600017）3月23日公告， 日照港股份有限公司第五届董事会第六次会议于2015年3月20日召开，会议审议通过了《日照港股份有限公司2014年年度报告》（全文及摘要）、《关于制定2014年度利润分配预案的议案》、《关于预计2015年度日常经营... ,http://stock.10jqka.com.cn/20150323/c571282064.shtml
2015-03-13 15:04,日照港董事长：支持在日照设立中韩自由贸易区,据齐鲁网报道，“建议尽快开建陕西神木至山西瓦塘铁路，打通陕北、蒙西乃至蒙古国出海新通道。支持在日照设立中韩自由贸易区。”全国人大代表，日照港（600017）集团董事长、党委书记杜传志在第十二届全国人民代表大会三次会议上发言时表示。... ,http://news.10jqka.com.cn/20150313/c571121080.shtml
2015-03-10 14:36,(两会)日照港董事长：建议统筹考虑青岛港、日照港...,大智慧阿思达克通讯社3月10日讯，大智慧通讯社从日照港（600017.SH）内部人士处获悉，9日（周一），全国人大代表、日照港集团有限公司董事长、党委书记杜传志在山东代表团全体会议上建议，统筹考虑青岛港、日照港、连云港的三大港一... ,http://www.gw.com.cn/news/news/2015/0310/200000417964.shtml
2015-03-04 06:32,日照港与多国达成 物流合作协议,全国人大代表、日照港（600017）股份有限公司董事长杜传志昨日上午在京接受上证报记者采访时表示，日照港是山东省多方向的出海口，国家“一带一路”战略给公司发展带来重大机遇。去年以来，公司专门到吉尔吉斯斯坦、蒙古、哈萨克斯坦、土耳其... ,http://stock.10jqka.com.cn/20150304/c570942142.shtml
2015-03-03 15:16,日照港：与多国签署多项一带一路物流合作协议,全国人大代表、日照港（600017）股份有限公司董事长杜传志3日上午在接受上证报记者采访时表示，日照作为“一带一路”重大国家战略上的节点城市，在向中亚、蒙东等方向的跨境道路联通上有重要意义。日照港公司已经在吉尔吉斯斯坦、蒙古、哈萨... ,http://stock.10jqka.com.cn/20150303/c570933491.shtml
2015-02-27 11:50,发改委批复山东日照港原油码头项目 总投资约12亿,中国证券网讯 记者27日从发改委网站获悉，为提高日照港原油接卸能力，完善山东省沿海港口外贸进口原油运输系统，适应腹地石油化工产业发展需要，同意建设日照港岚山港区原油码头二期工程。该项目总投资约12亿元。国家发展改革委关于... ,http://news.cnstock.com/industry/sid_rdjj/201502/3351287.htm
2015-02-27 11:08,日照港岚山港区原油码头二期工程获批,发改委网站消息，为提高日照港（600017）原油接卸能力，完善山东省沿海港口外贸进口原油运输系统，适应腹地石油化工产业发展需要，发改委同意建设日照港岚山港区原油码头二期工程。项目建设1个30万吨级原油泊位(水工结构按靠泊45万吨级油船设... ,http://stock.10jqka.com.cn/20150227/c570869200.shtml
2015-02-25 14:00,中韩自贸协定有望上半年签订 青岛碱业涨停,据外媒报道，韩国称计划上半年正式签订中韩自贸协定，受此消息影响相关概念股飙涨明显。截止午盘，青岛碱业（600229）涨停，大连港（601880）涨近6%，大连国际（000881）、日照港（600017）涨近4%，连云港（601008）、锦州港（600190）、营口... ,http://stock.10jqka.com.cn/20150225/c570827099.shtml
2015-02-12 06:13,(独家)日照港积极对接“一带一路”，“东出海”和“西挺进”结合,大智慧阿思达克通讯社2月11日讯，日照港（600017.SH）证券部人士向大智慧通讯社表示，“21世纪海上丝绸之路”最新扩围至山东省，日照港作为重要节点城市，早已积极对接“一带一路”，目前来看最重要的便是着力打通“陆海”通道，实现... ,http://www.gw.com.cn/news/news/2015/0211/200000413200.shtml
2015-02-11 10:29,日照港调整方案获批 山东推进“一带一路”支点建设,中国证券网讯(记者 朱贤佳)据交通运输部网站披露，交通运输部和山东省人民政府近日联合批复《日照港（600017）石臼港区规划调整方案》，标志着日照港石臼港区由散杂货运输港向集装箱综合港和旅游港转变的发展格局基本形成。此举意味着山东正... ,http://news.10jqka.com.cn/20150211/c570712427.shtml
2015-01-27 13:58,午后中韩自贸区拉涨 日照港涨停 21世纪网 2015-01-27 13:53:15 0,核心提示： 午后，沪指跌逾2%以上，而中韩自贸区则逆势拉涨，截至发稿，涨幅3.60%，日照港涨停，营口港、锦州港、青岛碱业涨幅超过3%，7只个股涨幅超过2%。午后，沪指跌逾2%以上，而中韩自贸区则逆势拉涨，截至发稿，涨幅3.60%，日照港... ,http://money.21cbh.com/2015/1-27/0OMDEwMTZfMTM2NjQ0OA.html
2015-01-27 13:49,快讯：山东确定为一带一路海上战略支点 日照港涨停,搜狐证券讯 午后日照港突然拉升，截止发稿时，强势涨停。消息面上，1月27日，记者从山东省第十二届人民代表大会第四次会议得知：山东已被确定为国家“一带一路”规划海上战略支点和新亚欧大陆桥经济走廊沿线重点地区。为此，2015年山东将抓住此机... ,http://stock.sohu.com/20150127/n408105964.shtml
2015-01-23 10:05,必美宜悉售山东码头物流业务股权 复牌大升逾18%,"必美宜（00379）今日复牌，现爆升18.37%，报0.232元；成交约598万股，涉资139万元。 公司公布，与日照港(600017,股吧)股份（沪：600017）、新加坡石化及上海谷隆订出售协议，以约11.34亿元悉数出售山东省日照港岚山港区码头及物流服务业务50%... ",http://hk.stock.hexun.com/2015-01-23/172678813.html
2015-01-21 10:56,(独家)日照港新增10个泊位投产，新增产能约1600万吨,大智慧阿思达克通讯社1月21日讯，日照港（600017.SH）证券部人士向大智慧通讯社表示，目前，日照港有10个新增通用泊位简易投产，待码头后方的堆场完全建成，可新增产能约1600万吨。“该10个泊位的投产，将有助于支撑公司2015年的吞吐... ,http://www.gw.com.cn/news/news/2015/0121/200000407037.shtml
2015-01-20 10:14,日照港通首个重载列车 山东争取纳入“一带一路”建设,中国证券网讯(记者 朱剑平)1月13日23:45，首列经瓦日线驶入日照港（600017）的重载列车55003次列车在日照港实现卸车作业。这是国内最高等级的万吨列电气化重载铁路瓦日铁路首次通行重载列车成功。这意味着，2014年以来山东一直争取的部分城市... ,http://stock.10jqka.com.cn/20150120/c569916213.shtml
2015-01-16 09:56,日照：瓦日铁路建成通车,1月13日21：43分，装满焦煤的55003次列车驶入日照港。这是瓦日铁路（原山西中南部铁路通道，山西瓦塘至山东日照港）建成后，首列经瓦日线驶入日照港的重载列车。该列车本次执行中国铁路总公司组织的瓦日铁路货物列车拉通试验。列车由山... ,http://finance.glinfo.com/15/0116/09/BCEB2C634B9FF5B3.html
2015-01-08 01:16,终止7年合作 青岛港日照港将“贴身近战”,每经记者 彭斐 发自山东 7年前，梦想共赢的青岛港与日照港在集装箱业务方面携手。如今，这段对手间的联姻，终未能逃脱“七年之痒”的魔咒。《每日经济新闻》记者从日照港（600017，SH）方面获悉，在征得日照港集团同意后，青岛港方面将转让... ,http://www.nbd.com.cn/articles/2015-01-08/889095.html
2015-01-05 10:52,山东：“四纵四横”货运铁路网项目全部开工,山东加快以货运为主的“四纵四横”铁路网项目建设，环渤海地区城际轨道交通网也在有序展开，打造客货分离、货畅其流、客畅其行的路网新格局。日照港铁运公司生产业务科长刘鑫称：“今年通过新荷兖日铁路线的车辆，将近150多万节，通过... ,http://finance.glinfo.com/15/0105/10/1F89A99AED2B1FD8.html
2015-01-04 23:26,港口大省山东怎解竞合难题 青岛港与日照港标志性合作走到尽头,经济导报首席记者 时超 青岛港与日照港始自8年前的一次引人注目的“强强合作”，如今突然走到尽头。近日，青岛产权交易所一则挂牌公告显示，青岛港集团旗下上市公司---青岛港国际股份有限公司（06198.HK）有意转让手中持有的日照日... ,http://finance.sina.com.cn/stock/y/20150104/232221219936.shtml
2014-12-31 11:02,(独家)晋豫鲁铁路28日全线通车，日照港利好兑现在即,大智慧阿思达克通讯社12月31日讯，大智慧通讯社从知情人士处获悉，晋豫鲁铁路已于28日全线通车，并于近日在山东、河南、山西三个省份部分路段进行了通车试验。该铁路以日照港（600017.SH）作为出海口，分析人士向大智慧通讯社指出，... ,http://www.gw.com.cn/news/news/2014/1229/200000400831.shtml
2014-12-28 23:02,投资收益“呵护”日照港集团 去年占比85%竟成业绩主要支撑,经济导报记者 杜海 几天前，大公国际发布的一份跟踪评级报告显示，经综合分析，对日照港集团主体信用等级维持AA+，对其2014年度第二期短融券信用等级维持A-1。经济导报记者查阅其最新经营数据发现，今年1-9月，日照港集团实现营业... ,http://finance.sina.com.cn/stock/t/20141228/230121181773.shtml
2014-12-12 10:56,日照港：第五届董事会第四次会议决议公告,证券代码:600017 股票简称:日照港 编号:临 2014-060 债券代码:122121 债券简称:11 日照港 债券代码:122289 债券简称:13 日照港 日照港股份有限公司 第五届董事会第四次会议决议公告 本公司董事会及全体董事保证本公告内容不存在任何虚假记载... ,http://stock.stockstar.com/JC2014121100002907.shtml
2014-12-09 13:44,(市场)港口股午后快速拉升，宁波港等五股涨停,大智慧阿思达克通讯社12月9日讯，港口股午后快速拉升，截至13:24，连云港(601008.SH)、盐田港(000088.SZ)、珠海港(000507.SZ)、营口港(600317.SH)、宁波港(601018.SH)涨停，日照港(600017.SH)涨逾9%，大连港(601880.SH)涨逾8%。区域... ,http://www.gw.com.cn/news/news/2014/1209/200000395249.shtml
2014-11-12 05:46,铁矿石年内暴跌40% 贸易商“阵亡”数量在上升,“山东日照港很多铁矿石贸易商的办公楼都空了，有些贸易商搬走了、有些改行了。今年有不少中小贸易商都还没有开张，过一阵子或许就转行干别的去了。”刚刚在日照港进行详细调研的冠通期货分析师严鹏飞如是说。注意到，2014年铁矿石价格一... ,http://info.glinfo.com/14/1112/05/0089E74E40CBE59C.html
2014-10-29 14:52,日照港三季报点评：业绩小幅低于预期 维持“增持”评级,"投资要点: 公司公告2014年三季报业绩,报告期内公司实现营业收入38.60亿元,同比增长3.19%;实现归属净利5.70亿元,同比下降6.80%;实现EPS为0.185元。业绩小幅低于预期,三季度单季业绩下降较大。1)我们业绩前瞻中预计公司实现归属净利润6.04亿,EP... ",http://stock.10jqka.com.cn/20141029/c568070711.shtml
2014-10-28 14:02,日照港架起“抑尘长城” 年减少粉尘排放3万吨,本报讯(记者徐凯) 红色夕阳下，一条钢铁巨龙从港口吐出，跨过鳞次栉比的铁路线、货运站、油罐区，横亘在蜿蜒广阔的海岸线之上，飘洋过海而来的矿石经由“龙”腹一吞一吐便转运至钢厂。这里的巨龙指的是管状矿石皮带机。10月23日，根据十项环... ,http://stock.10jqka.com.cn/20141028/c568053433.shtml
2014-10-11 06:55,日照港打响铁矿石汽运疏港品牌,连日来，一辆辆汽车频繁进出日照港各大矿石堆场，为当地钢铁企业承运进口铁矿石生产原料，随到随装，保质保量，智能检斤，快速发运，昼夜发货量高达15.27万吨，屡创汽运疏港历史新高。今年前9个月，全公司共累计完成汽运发货量3170万吨，... ,http://info.glinfo.com/14/1011/06/1CC2ED35EEF6A477.html
2014-09-22 13:11,日照大宗商品交易中心近期将上线运营,大智慧阿思达克通讯社9月22日讯，大智慧通讯社从多位知情人士处获悉，由日照港集团有限公司和鲁证期货有限公司发起设立的日照大宗商品交易中心有限公司将于近期上线运行。接近日照港（600017.SH）的知情人士向大智慧通讯社表示，日照... ,http://www.gw.com.cn/news/news/2014/0922/200000378883.shtml
2014-08-22 13:39,港口板块大涨超4％，中蒙合作及中韩贸易合作区启动或是主因,大智慧阿思达克通讯社8月22日讯，周五港口股飙升，午后开盘后更是一路上扬，截至13:19，板块涨幅4.4%，个股方面，营口港（600317.SH）、唐山港（601000.SH）、锦州港（600190.SH）均强势涨停，日照港（600017.SH）、大连港（601880.S... ,http://www.gw.com.cn/news/news/2014/0822/200000372478.shtml
2014-08-19 12:30,日照港2014年半年报点评：业绩符合预期 维持“增持”评级,"公司公告2014年半年报业绩,报告期内公司实现营业收入26.14亿元,同比增长4.46%;实现归属净利4.01亿元,同比下降1.65%;实现EPS为0.13元。业绩符合预期,内贸业务助力稳定增长。1)我们业绩前瞻中预计公司实现EPS0.13元,公司公告业绩符合预期。2)公... ",http://stock.10jqka.com.cn/20140819/c567002861.shtml
2014-07-04 15:24,7月4日的股市，有两个板块惹人注目，一个是新股全部涨...,7月4日的股市，有两个板块惹人注目，一个是新股全部涨停，飞天诚信、龙大肉食、雪浪环境、联明股份、今世缘等连续涨停板，占据涨停榜重要位置；一个是中韩自贸区概念集体下挫，大连港、日照港、大连国际、锦州港等位于跌幅榜的前列。这些市场... ,http://licaishi.sina.com.cn/web/viewInfo?v_id=163736
2014-07-04 01:16,航运港口股集体大涨 机构卖出大连港、日照港,每经记者 王一鸣 近段时间，港口股大涨，受此带动，昨日（7月3日）航运股亦跟随上涨，出现了港口股、航运股集体涨停的局面，不过，其中的大连港（601880）、日照港（600017）遭遇机构卖出。《每日经济新闻》记者注意到，日前，上海国际航... ,http://stock.10jqka.com.cn/hks/20140704/c566386110.shtml
2014-06-24 15:08,晋豫鲁铁路“运来”红利，日照港发展获良机,大智慧阿思达克通讯社6月24日讯，6月19日，我国里程最长的万吨重载铁路--晋豫鲁重载铁全线贯通。通车之后，山西中南部的煤炭可以直接运达日照港（600017.SH），该铁路预计2014年底通车，近期设计运能1亿吨，远期2亿吨。有业内人士表... ,http://www.gw.com.cn/news/news/2014/0624/200000356033.shtml
2014-06-24 10:52,(盘中特供)日照港大机遇：晋豫鲁铁路开通将使净利暴增50％以上,大智慧阿思达克通讯社6月24日讯（盘中特供全网首发在大智慧通讯社官方微信dzh_news，欢迎添加），熟悉港口事务的业内人士向大智慧通讯社表示，我国万吨重载铁路--晋豫鲁重载铁路6月19日全线通车，该铁路年底运行后，日照港（600017.S... ,http://www.gw.com.cn/news/news/2014/0624/200000355837.shtml
2014-06-20 14:16,发改委收储670万吨煤炭,国家发改委为保障应急情况下的煤炭供应，下达《2014年煤炭应急储备任务》，今年安排煤炭应急储备任务670万吨。今年国家煤炭储备应急储备任务中，秦皇岛港仍为最大的储备点，任务量为150万吨，黄骅港任务量为90万吨，舟山港任务量为60万吨，曹... ,http://hk.stock.hexun.com/2014-06-20/165892491.html
2014-06-19 20:28,日照港(600017)：产能瓶颈和货物分流影响短期业绩 明...,"一季度金属矿石、煤炭吞吐量下滑。一季度公司完成货物吞吐量6328万吨,同比增长2.2%,其中金属矿石3847万吨,同比下降4.1%,煤炭及制品878万吨,同比下降2%。一季度全国港口铁矿石吞吐量同比上升14.5%,煤炭吞吐量同比上升3%,而公司金属矿石、煤炭... ",http://stock.10jqka.com.cn/20140619/c566170970.shtml
2014-06-10 01:02,环渤海港口林立 产能过剩隐现,每经记者 彭斐 发自青岛、日照 2006年，在中国沿海港口最近一次的规划中，日照港及以北的港口，被划为“环渤海地区港口群”，业界亦称作“北方港口”。在环渤海C形港口版图上，青岛港、天津港、大连港三大主枢纽港，当仁不让地分别扮... ,http://finance.sina.com.cn/roll/20140610/005719358509.shtml
2014-05-25 22:42,日照港分羹低利率“点心债” 离岸债券首现银行担保,经济导报记者 孙罗南 人民币汇率持续走低并未减退海外投资者的持有意愿，“点心债”（香港离岸人民币债券）市场近期明显升温。日照港集团也加入到这一热闹队伍中---本月，日照港集团通过香港子公司完成其离岸人民币债券融资计划，... ,http://finance.sina.com.cn/stock/t/20140525/223819218780.shtml
2014-05-19 15:26,新闻稿：穆迪向日照港 (香港) 有限公司发行的债券授予A1评级,(以下中文新闻稿由穆迪提供。) 受评债务证券为人民币8.5亿元 香港，2014年5月15日-穆迪投资者服务... ,http://cn.reuters.feedsportal.com/c/33087/f/535387/s/3a91f907/sc/24/l/0Lcn0Breuters0N0Carticle0CcompanyNews0CidCNL3S0AO51MS20A140A5190DfeedType0FRSS0GfeedName0FcompanyNews/story01.htm
2014-04-28 07:04,日照港油品公司成功完成首次丙烯船舶接卸,24日，从韩国装载1500吨丙烯“安妮”轮船靠泊日照港油品公司5000吨级液化泊位，通过丙烯专用管线卸至新建球罐区，随着丙烯成功接卸、入库，油品公司完成首次丙烯船舶接卸，标志着公司新建球罐区试运营和新货种的接卸成功。为确保丙烯卸船... ,http://info.glinfo.com/14/0428/06/109D1561D40A52AA.html
2014-04-24 09:06,港达船舶重工“日港拖29”轮投入运营,"4月21日上午，日照港最大马力拖船“日港拖29”轮投入运营。据悉，“日港拖29”轮为6800HP（5000KW）全回转拖船，由日照港达船舶重工有限公司建造。该轮船长37.6m，型宽11m,双机双桨，灵活机动。该轮投入运营后，主要用于进出港船舶靠离... ",http://finance.glinfo.com/14/0424/09/884A6DCD38033B89.html
2014-04-16 22:40,[季报]日照港一季度净利1.72亿 同比下降5.45%,全景网4月16日讯 日照港（600017）周三晚间披露季报，公司2014年一季度实现净利润1.72亿元，同比下降5.45%，每股收益0.06元。公司一季度实现营业收入13.29亿元，同比增长3.23%。公司称，因去年同期冲销支付给山东蓝色经济区产权交易中心资... ,http://www.p5w.net/kuaixun/201404/t20140416_560781.htm
2014-04-15 09:38,日照港拟出售子公司100％股权，为集中发展主业,"大智慧阿思达克通讯社4月15日讯，日照港（600017.SH）14日晚间公告称，公司拟出售全资子公司日照港机工程有限公司100%股权 出售股权价格不低于交易标的截至2014年1月31日的股东权益评估值4,288.79万元。日照港表示，出售该子公司主要... ",http://www.gw.com.cn/news/news/2014/0415/200000334230.shtml
2014-04-14 22:50,[公司]日照港拟4289万底价售港机工程100%股权,全景网4月14日讯 日照港（600017）周一晚间披露，公司拟以不低于评估价4288.79万元的价格出售所持日照港机工程有限公司100%股权。目前，山东港湾建设集团有限公司表达了受让意向，如其最终中标，将构成关联交易。日照港指出，出售上述资产... ,http://www.p5w.net/kuaixun/201404/t20140414_557054.htm
2014-04-14 08:46,日照港成功技术改造环保清扫车,山东日照港（600017）股份二公司环保队科研攻关小组成功改造的环保清扫车日前正式投入使用并着手申报国家专利。据了解，该公司3万多块路侧隔离墩、6000多米防尘墙和方圆数十公里港区路面的冲刷清扫作业，此前一直是沿用传统洒水车和人工配合... ,http://stock.10jqka.com.cn/20140414/c564863672.shtml
2014-04-01 23:34,日照港畔的矿石码头博弈 8公里海岸线齐聚三大泊位,经济导报记者 王延锋 日照报道 在我国最大的铁矿石进口港日照港周围，正在兴起一波矿石码头建设热。“我们公司30万吨铁矿石码头马上就要建成，今年就能投入使用。”3月29日，在日照市岚山区岚桥港，一名工作人员对经济导报记者说。岚... ,http://finance.sina.com.cn/roll/20140401/232218682868.shtml
2014-03-20 16:12,日照港归还临时借用6亿元闲置募集资金,日照港3月20日发布公告称，经公司第四届董事会第十五次会议审议批准，公司于2013年3月28日借用6亿元募集资金补充流动资金，截止2014年3月20日，公司所借用资金已全部归还至募集资金专用账户。公司已将上述募集资金归还事项及时通... ,http://www.ccstock.cn/gscy/gongsi/2014-03-20/A1395302131392.html
2014-03-19 13:28,日照港：主业利润小幅提升 税收优惠减少抵消业绩增量,"2013年,日照港（600017）货物吞吐量同比增长5.7%;营收同比增长3.47%至49.66亿,毛利率同比下降0.49个百分点至27.95%;归属母公司净利润同比增加1.96%至8.02亿,EPS为0.26元;利润分配预案为每10股派息0.4元(含税)。事件评论 主业利润小幅提升,税... ",http://news.10jqka.com.cn/20140319/c564495131.shtml
2014-03-19 09:18,日照港(600017)发行10亿元公司债券,"本报日照讯 近日,日照港（600017）股份公司完成10亿元公司债券发行工作,募集资金于3月6日到账。为改善负债结构,降低利率市场化下的融资成本,2013年6月日照港股份公司启动了发行公司债券工作,并于同年11月底获得证监会核准文件。2014年2月下旬... ",http://stock.10jqka.com.cn/20140319/c564489581.shtml
2014-03-18 14:22,日照港净利同增1.96％，中长期受益于进口铁矿石增长,大智慧阿思达克通讯社3月18日讯，大智慧通讯社（微信:dzh_news)从日照港（600017.SH）公告获悉，公司2013年实现净利润8.02亿元，同比增长1.96%。申万证券研报认为，日照港年度业绩符合预期，吞吐量内生增长驱动业绩增长，中长期看，... ,http://www.gw.com.cn/news/news/2014/0318/200000325088.shtml
